,Title,Descr,Content,URL
18,Sở thú lâu đời nhất TP HCM nửa năm lỗ gần 20 tỷ đồng,"Bình quân mỗi ngày Thảo Cầm Viên lỗ 100 triệu đồng vì khách tham quan giảm mạnh, trong khi phải duy trì chi phí chăm sóc hơn 1.500 động vật.","Ban lãnh đạo Công ty TNHH MTV Thảo cầm viên Sài Gòn đang kêu gọi sự đóng góp của cộng đồng để duy trì sự sống cho 1.500 động vật. Ông Phạm Anh Dũng – Phó giám đốc cho hay, bình quân doanh thu bán vé mỗi ngày trước mùa dịch là 300 triệu đồng, nhưng hiện chỉ còn khoảng 15 triệu đồng.
Báo cáo tài chính nửa đầu năm của Thảo Cầm Viên ghi nhận doanh thu chưa đến 27 tỷ đồng, giảm hơn phân nửa so với cùng kỳ năm ngoái. Giá vốn trong giai đoạn này xấp xỉ 41 tỷ đồng, bao gồm chi phí nguyên vật liệu, nhân công... khiến công ty không có lãi.
Thảo Cầm Viên báo lỗ sau thuế lên đến 18,8 tỷ đồng và trở thành một trong bảy doanh nghiệp thuộc quản lý của UBND TP HCM phát sinh lỗ nửa đầu năm. Khoản lỗ này chỉ xếp sau Tổng công ty Cơ khí Giao thông vận tải Sài Gòn và Tổng công ty Du lịch Sài Gòn.
Theo lý giải của ban lãnh đạo, kết quả kinh doanh bết bát vì lượng khách mua vé tham quan giảm mạnh bởi dịch bệnh. Thảo Cầm Viên đã phải đóng cửa gần hai tháng, từ 20/3-14/5. Khi mở cửa thì lượng khách khả quan, nhưng chưa được lâu dịch bệnh đã diễn biến phức tạp trở lại.
Việc lỗ đậm trong nửa đầu năm khiến Thảo Cầm Viên khó hoàn thành kế hoạch có lãi 1,7 tỷ đồng đề ra hồi đầu năm. Năm ngoái, công ty thu hơn 110 tỷ đồng nhưng sau khi trừ chi phí nhân công, nguyên vật liệu, khấu hao tài sản cố định... thì cũng chỉ lãi chưa đến 1,6 tỷ đồng.
Tình hình càng khó khăn hơn khi Thảo Cầm Viên đang nợ hơn 18 tỷ đồng, trong đó phần lớn là các khoản phải trả cho người lao động. Mới đây, ban lãnh đạo công ty cho biết gần 270 nhân viên đã đồng lòng giảm 30% lương để có ngân sách duy trì chế độ tốt nhất cho động vật.
Thảo Cầm Viên được xây dựng từ năm 1864 với tên gọi đầu tiên là Vườn Bách Thảo, sau đó được người dân TP HCM quen gọi là Sở thú. Thảo Cầm Viên hiện có nguồn vốn gần 700 tỷ đồng, là doanh nghiệp 100% vốn nhà nước do UBND TP HCM quản lý.
Công trình có tuổi đời 156 năm được xây dựng cùng thời với Bưu điện thành phố, Nhà thờ Đức Bà, chợ Bến Thành... và được Đô đốc Toàn quyền Đông Dương Pierre-Paul De La Grandière kỳ vọng trở thành nơi bảo tồn động thực vật, phục vụ các công trình nghiên cứu khoa học.
Phương Đông",https://vnexpress.net/so-thu-lau-doi-nhat-tp-hcm-nua-nam-lo-gan-20-ty-dong-4143503.html
19,Tỷ phú Ấn Độ giàu thứ 4 thế giới,"Người giàu nhất châu Á – Mukesh Ambani đã vượt ông chủ LVMH trong danh sách người giàu của Bloomberg, với tài sản 80,6 tỷ USD.","Theo Bloomberg Billionaires Index, tài sản của Chủ tịch Reliance Industries Mukesh Ambani đã tăng 22 tỷ USD năm nay, lên 80,6 tỷ USD. Ông hiện giàu hơn ông chủ LVMH Arnault (tài sản 80,2 tỷ USD).
Sau phiên giao dịch cuối tuần, tài sản của Ambani tăng hơn 300 triệu USD. Trong khi đó, Arnault mất hơn 1,2 tỷ USD. Cổ phiếu LVMH gần đây đi xuống, do người dân hạn chế mua hàng thời trang xa xỉ trong đại dịch.
Người giàu nhất thế giới vẫn là ông chủ Amazon Jeff Bezos với 187 tỷ USD. Xếp sau là Bill Gates và Mark Zuckerberg với lần lượt 121 tỷ USD và 102 tỷ USD.
Vài tuần gần đây, tài sản của người giàu nhất châu Á liên tiếp vượt qua các tài phiệt hàng đầu thế giới, từ CEO Tesla Elon Musk, hai đồng sáng lập Google Larry Page và Sergey Brin đến tỷ phú đầu tư Warren Buffett.
Dù đế chế của Ambani cũng chịu tác động mạnh khi nhu cầu dầu thô lao dốc trong đại dịch, cổ phiếu hãng này vẫn tăng hơn gấp đôi kể từ đáy tháng 3. Nguyên nhân là mảng dịch vụ kỹ thuật số của công ty nhận tiền đầu tư từ hàng loạt đại gia như Facebook và Google.
Đế chế năng lượng của Ambani đang dần chuyển sang thương mại điện tử. Các đại gia công nghệ toàn cầu đều muốn hưởng lợi từ lĩnh vực đang tăng trưởng rất nhanh này tại Ấn Độ. Gần đây, quốc gia đông dân thứ nhì thế giới được nhà đầu tư ngoại quan tâm, đặc biệt là từ Thung lũng Silicon. Google tháng trước cũng cho biết sẽ chi 10 tỷ USD trong vài năm tới để giúp tăng tốc số hóa nền kinh tế này.
Hà Thu (theo Bloomberg)",https://vnexpress.net/ty-phu-an-do-giau-thu-4-the-gioi-4143609.html
20,Người giàu thế giới mất bao nhiêu năm để thành tỷ phú?,"CEO Facebook Mark Zuckerberg chỉ mất 4 năm để kiếm được tỷ USD đầu tiên, trong khi ông chủ Zara Amancio Ortega mất tới 26 năm.","Theo phân tích của công ty OLBG (Anh) dựa trên danh sách năm nay của Forbes, các tỷ phú thế giới mất trung bình 21 năm để sở hữu tỷ USD đầu tiên. Một số người, như CEO Facebook Mark Zuckerberg chỉ mất vài năm để vào danh sách tỷ phú. Trong khi đó, ông chủ Zara Amancio Ortega lại mất tới gần 30 năm.
OLBG chỉ tính các tỷ phú tự thân. Họ tìm ra thời gian những người này trở thành tỷ phú bằng cách trừ năm được Forbes công nhận cho năm bắt đầu khởi nghiệp. Dưới đây là thời gian kiếm được tỷ USD của các tỷ phú trong top đầu thế giới.
10. Amancio Ortega
Thời gian trở thành tỷ phú: 26 năm
Tài sản hiện tại: 64,2 tỷ USD
Nguồn tài sản: Inditex (công ty mẹ Zara)
Tỷ phú 84 tuổi của Tây Ban Nha mở cửa hàng thời trang đầu tiên cùng người vợ trước - Rosalia Mera năm 1975. Hiện tại, ông đã sở hữu đế chế Inditex với hàng nghìn cửa hàng trên thế giới. Ortega hiện còn có khối bất động sản khoảng 15,2 tỷ euro (17,2 tỷ USD).
9. Warren Buffett
Thời gian trở thành tỷ phú: 23 năm
Tài sản hiện tại: 79,2 tỷ USD
Nguồn tài sản: Berkshire Hathaway
Nhà thông thái vùng Omaha nổi tiếng với triết lý đầu tư giá trị. Ông đã thành công với chiến lược này, dù phải mất thời gian khá dài để kiếm được tỷ USD đầu tiên. Tài sản của ông chủ yếu đến từ công ty đầu tư Berkshire Hathaway.
8. Bernard Arnault
Thời gian trở thành tỷ phú: 13 năm
Tài sản hiện tại: 107,1 tỷ USD
Nguồn tài sản: LVMH
Tỷ phú thời trang Pháp năm nay 71 tuổi và hiện là người giàu nhất giới thời trang toàn cầu. Dù vậy, đại dịch đang khiến đế chế hàng xa xỉ của ông lao đao. Cổ phiếu LVMH đang đi xuống suốt gần một tháng qua.
7 và 6. Steve Ballmer và Bill Gates
Thời gian trở thành tỷ phú: 12 năm
Tài sản hiện tại: 72,4 tỷ USD và 113,6 tỷ USD
Nguồn tài sản: Microsoft
Bill Gates đồng sáng lập đế chế phần mềm Microsoft cùng bạn học Paul Allen. Công ty này giúp Gates trở thành tỷ phú năm 1986.Còn Ballmer là nhân viên đầu tiên của Microsoft. Ông bỏ Trường Kinh doanh Stanford để gia nhập công ty năm 1980 và cũng trở thành tỷ phú nhờ số cổ phần tại đây.
5. Larry Ellison
Thời gian trở thành tỷ phú: 9 năm
Tài sản hiện tại: 71,8 tỷ USD
Nguồn tài sản: Oracle
Larry Ellison được đánh giá là một trong những nhân vật thú vị nhất giới công nghệ. Ông hai lần bỏ học đại học và đồng sáng lập hãng phần mềm Oracle. Ellison cũng nổi tiếng với cuộc sống phóng khoáng, sở hữu nhiều bất động sản, du thuyền.
4 và 3. Sergey Brin và Larry Page
Thời gian trở thành tỷ phú: 6 năm
Tài sản hiện tại: 65,2 tỷ USD và 67 tỷ USD
Nguồn tài sản: Alphabet – công ty mẹ Google
Larry Page và Sergey Brin đồng sáng lập Google năm 1998 khi đang theo học tiến sĩ tại Đại học Stanford. Cả hai lãnh đạo Alphabet nhiều thập kỷ trước khi rời đi hẳn vào tháng 12/2019.
2. Jeff Bezos
Thời gian trở thành tỷ phú: 5 năm
Tài sản hiện tại: 189 tỷ USD
Nguồn tài sản: Amazon
Jeff Bezos bỏ việc tại một quỹ đầu tư ở New York City để bán sách online năm 1994. Công ty của ông có tên Amazon, sau này nhanh chóng trở thành hãng bán lẻ lớn nhất thế giới, giúp Bezos trở thành người giàu nhất hành tinh hiện tại.
1. Mark Zuckerberg
Thời gian trở thành tỷ phú: 4 năm
Tài sản hiện tại: 98,6 tỷ USD
Nguồn tài sản: Facebook
Mark Zuckerberg thành lập Facebook tại phòng ký túc xá Đại học Harvard. 15% cổ phần của Zuckerberg trong này giúp anh hiện là người giàu thứ 4 thế giới. Dù vậy, Zuckerberg và vợ Priscilla Chan đã cam kết sẽ cho đi phần lớn tài sản để làm từ thiện.
Hà Thu (theo BI)",https://vnexpress.net/nguoi-giau-the-gioi-mat-bao-nhieu-nam-de-thanh-ty-phu-4143488.html
21,Tiêu xuất khẩu giảm giá mạnh,Sức mua trên thị trường thế giới giảm do tác động của Covid-19 khiến giá tiêu giảm mạnh.,"Báo cáo của Tổng cục Hải quan cho thấy, 7 tháng đầu năm 2020 xuất khẩu tiêu đạt 187.000 tấn và 405 triệu USD, giảm 6,5% về khối lượng và giảm 20,6% về giá trị so với cùng kỳ năm 2019.
Theo đó, giá tiêu xuất khẩu bình quân 6 tháng năm 2020 đạt 2.134 USD một tấn, giảm 16,4% so với cùng kỳ năm 2019.
Theo Cục Chế biến và Phát triển Thị trường Nông sản, sở dĩ giá tiêu giảm mạnh trong nửa đầu năm là do hầu hết thị trường lớn đều giảm cả về khối lượng và giá trị do chịu tác động kép từ đại dịch Covid-19 và dư cung.
Trong 5 thị trường xuất khẩu tiêu lớn nhất của Việt Nam với 37,9% thị phần, bao gồm Mỹ, Ấn Độ, Đức, Pakistan và Hà Lan, chỉ Mỹ có khối lượng xuất khẩu tăng, còn các thị trường khác đồng loạt giảm.
Trong nước, giá hạt tiêu trong tháng 7 giảm nhẹ so với tháng trước. Giá tiêu tại Bà Rịa Vũng Tàu, Đắk Lắk, Đắk Nông giảm 500-1.000 đồng một kg xuống 48.000-49.000 đồng một kg.
Các chuyên gia dự báo, trong những tháng tới sức mua sẽ tiếp tục giảm từ thị trường châu Âu và Mỹ trước làn sóng dịch thứ 2 tại các thị trường này. Thêm vào đó, thảm họa thiên tai tại Trung Quốc, một trong các thị trường nhập khẩu hồ tiêu lớn của Việt Nam, sẽ tác động đến nhu cầu nhập khẩu hồ tiêu của quốc gia này trong giai đoạn ngắn hạn. Do đó, các doanh nghiệp xuất khẩu cần lựa chọn các biện pháp thực thi và thanh toán hợp đồng nhằm giảm thiểu rủi ro, hạn chế các phát sinh thương mại quốc tế.
Hồng Châu",https://vnexpress.net/tieu-xuat-khau-giam-gia-manh-4143667.html
22,Chiến thuật lốp cho Grand Prix 70 năm F1,Loạt sự cố ở Silverstone tuần trước khiến lốp trở thành chủ đề được quan tâm nhất trước vòng đua chính Grand Prix 70 năm F1 hôm nay.,"Tính toán của Pirelli ở chặng đua tuần trước khiến các đội phải dùng bộ lốp trung bình trong thời gian dài trên đường đua khắc nghiệt bậc nhất lịch thi đấu. Vấn đề càng nghiêm trọng khi xe an toàn sớm xuất hiện, và nền nhiệt ở Silverstone rất cao. Hôm nay, các tay đua vẫn tranh tài trên đường đua Silverstone. Nhưng ít nhất, họ sẽ không phải đối mặt với chiếc lốp đó nữa, sau khi Pirelli quyết định cung cấp bộ lốp mềm hơn một cấp cho chặng đua kỷ niệm 70 năm F1.
Với thay đổi này, lốp 'cứng' của cuối tuần trước - loại lốp ưa thích các tay đua - sẽ không được cung cấp. Lốp cứng của tuần này tương đương lốp trung bình của cuối tuần trước, và lốp ""trung bình"" của tuần này là lốp mềm của tuần trước. Với những chiếc lốp có độ mềm lớn hơn, các tay đua dự kiến sẽ phải thực hiện chiến thuật 2 pit, thay vì một như tuần trước.
Các buổi đua thử hôm thứ Sáu 7/8 cho thấy bộ lốp mềm gần như không hoạt động tối ưu đủ cho flying-lap. Loại lốp mềm này chỉ hoạt động tốt dưới nền nhiệt cao ở Silverstone khi chạy ở cung đường đầu tiên (Sector 1), trước khi nhanh chóng quá nhiệt, xuống cấp ở Section 2 và Sector 3.
Đó là lý do trong vòng phân hạng hôm thứ Bảy 8/8, rất nhiều tay đua chọn dùng lốp trung bình để lọt vào Q3, dù về lý thuyết, nếu dùng lốp mềm, họ sẽ có thành tích tốt hơn. Ở Q3, tại lượt chạy thứ hai, cả hai chiếc W11 của Mercedes đều dùng lốp trung bình, nhưng vẫn nhanh hơn những xe khác (dùng lốp mềm) gần 1 giây, và nhanh hơn thành tích của chính họ ở lượt chạy thứ nhất - lượt chạy mà cả hai còn dùng lốp mềm. Nhiều tay đua phàn nàn về việc Pirelli lựa chọn độ mềm cho lốp quá lớn trong điều kiện nhiệt độ cao.
Một số tay đua sử dụng lốp mềm tại Q2 thậm chí không thể vào top 10, mà Sebastian Vettel là ví dụ. Tay đua của Ferrari xuất phát từ vị trí thứ 11, nhờ Esteban Ocon bị hạ 3 bậc xuất phát, được thoải mái lựa chọn lốp xuất phát. Nhiều khả năng Vettel sẽ xuất phát với bộ lốp cứng như Max Verstappen, tay đua dùng lốp cứng nhưng vẫn lọt vào top 10. Tuy nhiên, liệu đây có phải là một lợi thế chiến thật hay không thì còn phụ thuộc vào cảm giác lái của Vettel trong cuộc đua sau khi anh vật lộn với chiếc SF1000 suốt cả ngày thứ Sáu và thứ Bảy.
Diễn biến cuộc đua hôm nay, được dự báo, sẽ rất khác so với cuộc đua tuần trước do Pirelli cung cấp bộ lốp có độ mềm lớn hơn nhằm hướng các đội về chiến thuật 2 pit, an toàn hơn về lốp. Nhưng điều này đặt ra hai câu hỏi lớn.
Đầu tiên là bộ lốp mềm sẽ ảnh hưởng thế nào tới chất lượng cuộc đua? Dĩ nhiên, điều này sẽ đem đến một cuộc đua đa dạng hơn, khó đoán hơn về mặt chiến thuật. Max Verstappen sẽ xuất phát thứ tư với bộ lốp cứng - một thành tích bất thường. Các tay đua không xuất phát bằng lốp cứng có thể kéo dài thời gian sử dụng bộ lốp xuất phát (lốp trung bình), trước khi chuyển sang dùng lốp cứng cho tới khi cuộc đua kết thúc. Nhưng Silverstone là một đường đua rất khắc nghiệt cho lốp xe. Tốc độ lốp xuống cấp nhanh có thể ngăn cản các đội sử dụng chiến thuật 1 pit. Và như vậy khi chênh lệch về tốc độ giữa việc sử dụng các bộ lốp mới và lốp cũ là rất lớn, thời gian tiết kiệm do thay lốp ít hơn không thể bù đắp nổi. Tuy nhiên, đấy chỉ là những tính toán trên lý thuyết, nếu chặng đua không có biến động lớn.
Như ở Grand Prix Anh tuần trước, xe an toàn, nếu xuất hiện, sẽ đảo lộn hoàn toàn cục diện. Những tay đua sử dụng chiến thuật 1 pit như Verstappen có thể sẽ hy vọng thời điểm xe an toàn triển khai sẽ lệch đi so với khung thời gian vào pit của các đối thủ. Nếu vậy, Verstappen sẽ được hưởng lợi lớn nếu các sự cố trên đường đua.
Câu hỏi quan trọng thứ hai, cũng liên quan đến lốp xe: Pirelli có thể để đảm bảo không có sự cố nào lặp lại như tuần trước không? Cả hai chiếc Mercedes đều gặp sự cố vào tuần trước, nhưng chỉ một trong số 18 chiếc còn lại bị sự cố tương tự. Hiệu suất của W11 lớn hơn nhiều so với các đối thủ, nhưng mặt trái là nó có thể khiến lốp nhanh bị xuống cấp hơn. Điều này đồng nghĩa với việc bộ đôi Mercedes rất dễ ôm hận, vì mọi thứ khó mà diễn ra theo cách may mắn như với Hamilton tuần trước.
Minh Phương tổng hợp",https://vnexpress.net/chien-thuat-lop-cho-grand-prix-70-nam-f1-4143665.html
23,Tiger Woods hết cửa tranh PGA Championship 2020,"Không thể cải thiện hiệu quả gạt bóng ở vòng ba hôm 8/8, ""Siêu Hổ"" ghi điểm +2 và đứng ngoài cuộc đua vô địch major PGA Championship.","Sau khi đạt điểm even par và thoát cắt loại, Woods dùng tới 31 cú gạt bóng (putt) trong 72 cú đánh qua 18 hố của vòng áp chót. Kết quả đó khiến anh tụt xuống T59 sau 54 hố với điểm +2.
Dustin Johnson độc chiếm đỉnh bảng ở điểm -9. Ngay sau anh, Scottie Scheffler và Cameron Champ ở T2 với điểm -8. Kém nhóm này một gậy là T4 gồm ĐKVĐ Brooks Koepka, Collin Morikawa và Paul Casey. Từ đỉnh bảng đến T7 (-6) có 12 đấu thủ. Còn Woods cách đỉnh bảng đến 11 gậy.
Theo cục diện này, ""Siêu Hổ"" xem như không thể tranh chiếc cúp Wanamaker. Để có thể đảo ngược tình thế, Woods cần tới hai phép màu: bản thân anh cần đánh 59 gậy kỷ lục, còn toàn bộ nhóm đầu phải đứng yên trong 18 hố cuối.
Woods xuất phát từ hố 1 và liên tục giữ par qua bảy hố. Dù có một số cơ hội birdie ở đoạn này, anh đều gạt bóng hỏng. Đến hố 8 par3, rắc rối bắt đầu xảy ra. Bóng cách miệng hố gần tám mét, nhưng Woods phải dùng ba putt mới xong và vướng bogey. Rồi từ hố 11 đến 13, anh thêm ba bogey. Hố tiếp đó, Woods lùa bóng vào hố từ cự ly 3 mét để cắt mạch bốn bogey.
Không chỉ putt kém, chủ nhân 15 major còn dùng gậy driver ""không ngọt"". Từ hố 6 đến 16, anh tám lần phát lệch phải fairway, dù biết rõ một khi bóng vào khu cỏ rough hoặc ngoài ranh này thì khó thể lên green theo chuẩn. Trong ba hố cuối, Woods mới lấy được hai birdie bằng pha putt 4,5 mét ở hố 16 và 1,5 mét ở hố 18.
Trong 24 năm qua, nếu không giỏi dùng gậy gạt bóng (putter), hẳn Woods khó thể tạo nên bộ sưu tập thành tích đồ sộ, kiếm gần 120,7 triệu USD. Nhưng hai ngày qua, putter không còn là đũa thần trong tay Woods.
Trước khi vào PGA Championship, anh đổi gậy gạt. Hàng mới vẫn là dòng Scotty Cameron Newport 2 GSS, nhưng cán dài hơn để giảm áp lực cho phần lưng dễ tổn thương và có khả năng điều chỉnh trọng lượng đầu gậy. Trong bộ sưu tập 15 major, anh đoạt 14 danh hiệu khi dùng hàng cũ.
""Chung quy là do đọc green và gạt không đủ lực. Cảm quan về green và cảm giác bóng của tôi không khớp với nhau. Ở khu green tập, tôi putt lên dốc nhiều hơn để lấy cảm giác và bù vào chuyện thiếu lực trên green thực địa. Nhưng kết quả vẫn thế"", Woods nói sau vòng ba.
Gạt bóng kém liên tục 36 hố, nhưng Woods không đổ lỗi cho putter. ""Nếu tôi putt đủ mạnh, thì sẽ vào thôi"", Woods nói, gián tiếp phủ nhận khả năng bỏ mẫu putter mới nhất của hãng Titleist. Với 13 cây còn lại, anh dùng hàng TaylorMade.
Quốc Huy tổng hợp",https://vnexpress.net/tiger-woods-het-cua-tranh-pga-championship-2020-4143678.html
24,Messi nới rộng cách biệt kỷ lục với Ronaldo,"Thủ quân Barca, Lionel Messi biến Napoli trở thành đối thủ thứ 35 bị anh chọc thủng lưới tại Champions League.","Messi đạt cột mốc mới khi ghi bàn nâng tỷ số lên 2-0 trong trận lượt về vòng 1/8 tối 8/8, góp phần quan trọng vào chiến thắng 3-1 của Barca. Tính chung cuộc, anh và các đồng đội vào tứ kết với tổng tỷ số 4-2.
Cristiano Ronaldo và Raul Gonzalez cùng đứng thứ hai sau Messi. Mỗi người đều đã chọc thủng lưới 33 đối thủ khác nhau ở Champions League. Karim Benzema và Zlatan Ibrahimovic xếp tiếp theo với cùng 29 đối thủ.
Tại Champions League, Arsenal là đối thủ ""khoái khẩu"" của Messi. Anh ghi tổng cộng chín bàn trong sáu lần đối đầu. Tiếp theo là AC Milan và Celtic, với mỗi đội tám bàn.
Ở vòng 1/8 Champions League, Messi chưa bao giờ nhận thất bại, và đã ghi 27 bàn.
Sau khi vượt qua Napoli, Barca sẽ gặp ứng cử viên nặng ký Bayern Munich ở tứ kết. Bayern giành suất đến Bồ Đào Nha chơi ""vòng chung kết"" khi thắng Chelsea với tổng tỷ số 7-1.
Thanh Quý (theo FCB, Marca)",https://vnexpress.net/messi-noi-rong-cach-biet-ky-luc-voi-ronaldo-4143585.html
25,Suarez: 'Cơ hội chia đều cho Barca và Bayern',"Tiền đạo Luis Suarez tin cửa vào bán kết của Barca và Bayern là ngang nhau, khi hai đội đối đầu tại tứ kết Champions League mùa này.","""Ở thể thức đấu loại trực tiếp một lượt, đội nào cũng có cơ hội"", Suarez nói với Sport sau trận thắng Napoli hôm 8/8. ""Tôi nghĩ cửa vào bán kết là 50-50. Bayern rất mạnh, là ứng viên vô địch mùa này còn chúng tôi cũng có thừa chất lượng khi góp mặt ở vòng tám đội hay nhất. Chúng tôi phải đương đầu với họ, dù là 90 hay 120 phút. Đội nào làm tốt hơn sẽ có mặt ở bán kết"".
Suarez góp một bàn cho Barca ở trận thắng Napoli 3-1 tại lượt về vòng 1/8 Champions League hôm 8/8. Clement Lenglet và Lionel Messi, trước đó, ghi bàn giúp đội chủ sân Camp Nou nắm lợi thế lớn. Barca, sau khi loại Napoli với tổng tỷ số 4-2, sẽ gặp Bayern - đội hạ Chelsea 7-1 qua hai lượt trận.
""Đã hai tuần từ khi La Liga kết thúc và chúng tôi tập trung chuẩn bị cho Champions League từ đó đến nay"", Suarez nói tiếp. ""Kết quả trước Napoli là điều chúng tôi mong muốn. Họ gây nhiều khó khăn cho chúng tôi ở lượt đi và một số thời điểm ở lượt về. Chúng tôi dẫn 3-0 nhưng đã có chút lo lắng khi bị gỡ 1-3. Ở hiệp hai, chúng tôi biết họ sẽ gây sức ép, nhưng Barca đã kiểm soát tốt trận đấu. Chúng tôi nghĩ đơn giản là phải chuyền liên tục, vì họ đá pressing và gần như không cho chúng tôi khoảng trống trong hiệp hai"".
Barca, sau khi vào tứ kết Champions League mùa thứ 13 liên tiếp, sẽ di chuyển đến Lisbon, Bồ Đào Nha để đá những vòng knock-out còn lại. Trận đấu giữa họ và Bayern sẽ diễn ra lúc 2h ngày 15/8, theo giờ Hà Nội. Đây được coi là cặp đấu cân bằng và hấp dẫn nhất vòng tứ kết. Ở lần chạm trán gần nhất, Barca hạ Bayern với tổng tỷ số 5-3 tại bán kết Champions League 2014-2015.
Nhân Đạt (theo Sport)",https://vnexpress.net/suarez-co-hoi-chia-deu-cho-barca-va-bayern-4143606.html
