,Title,Descr,Content,URL
48,Bài 'Đất Nước' vào đề Văn thi tốt nghiệp THPT,"Đề Văn thi tốt nghiệp THPT sáng 9/8 gồm hai phần, trong đó phần làm văn hỏi về tác phẩm ""Đất Nước"" của Nguyễn Khoa Điềm, chiếm 5 điểm.",">>Gợi ý làm bài
Cô Trịnh Thu Tuyết, giáo viên Ngữ văn Hệ thống giáo dục HOCMAI đánh giá đề thi Ngữ văn 2020 bám sát cấu trúc của đề thi tham khảo lần hai do Bộ Giáo dục và Đào tạo công bố. Phần Đọc hiểu (3 điểm) gồm 4 câu hỏi nhỏ. Trong đó, câu 1 yêu cầu nhận biết về một đặc điểm hình thức của ngữ liệu. Câu 2 và 3 yêu cầu nhận biết về các chi tiết nội dung trong ngữ liệu.
Duy nhất câu 4 ở mức độ vận dụng cao yêu cầu học sinh phải sử dụng hiểu biết về cuộc sống xã hội cùng những trải nghiệm cá nhân để thể hiện quan điểm trước một nhận định rút ra từ ngữ liệu. Với 3 câu hỏi nhận biết, học sinh hoàn toàn có thể đạt được điểm tối đa. Và như vậy, phần Đọc hiểu sẽ không làm khó và không làm mất thời gian của thí sinh.
Phần 2 Làm văn 7 đểm giữ nguyên cấu trúc như đề tham khảo. Câu nghị luận xã hội (2 điểm) vẫn yêu cầu học sinh nghị luận về một khía cạnh của vấn đề rút ra từ phần đọc hiểu, đó là ""sự cần thiết phải trân trọng cuộc sống mỗi ngày"". ""Sự cần thiết"" là ý nghĩa, vai trò, tầm quan trọng của ý thức ""trân trọng cuộc sống mỗi ngày"".
Có thể thấy, câu viết đoạn văn nghị luận xã hội đảm bảo đúng form, cấu trúc, dung lượng mà học sinh ôn luyện, phù hợp với thời lượng và quỹ điểm. Khía cạnh của vấn đề nghị luận cũng hướng tới một trong những điều quan trọng của cuộc sống mỗi cá nhân. Tuy nhiên, đây là vấn đề ít nhiều còn trừu tượng với những học trò 18 tuổi, chưa đủ trải nghiệm để có thể thấu hiểu ý nghĩa của mỗi giây phút được sống trong cuộc đời, vì thế rất có thể có những bài làm chung chung, lý thuyết và thiếu sự thiết thực với mỗi học trò.
Câu 2 nghị luận văn học (5 điểm) đề cập đến thông điệp tư tưởng quan trọng bao trùm không chỉ trong đoạn trích Đất Nước mà còn là tư tưởng chi phối toàn bộ giai đoạn văn học 1945-1975. Đây cũng là nội dung chính học sinh không thể bỏ qua khi tiếp cận giá trị nghệ thuật và nội dung của đoạn thơ. Tuy nhiên, ngữ liệu nghị luận theo yêu cầu của đề bài là 27 câu trong phần 3 của đoạn trích Đất Nước. Ngữ liệu này quá dài, quá bề bộn trong quỹ thời gian 120 phút của toàn bộ đề bài.
Nhìn chung, đề thi Ngữ văn của kỳ thi tốt nghiệp THPT 2020 đảm bảo đúng các yêu cầu về nội dung, hình thức của một đề thi tốt nghiệp. ""Đề không khó nhưng quá dài, đặc biệt là câu nghị luận văn học - câu hỏi chiếm quỹ điểm cao nhất trong bài. Điều đó, có thể khiến học sinh lúng túng để hoàn thành tốt bài thi"", cô Tuyết đánh giá.
Năm nay lần đầu tiên trong lịch sử kỳ thi tốt nghiệp THPT bị lùi một tháng rưỡi và chia làm hai đợt do ảnh hưởng của dịch bệnh. Khoảng 870.000 thí sinh thi đợt một ngày 9-10/8. Những địa phương thực hiện cách ly xã hội như Đà Nẵng, một số nơi ở Quảng Nam, TP Buôn Ma Thuột (Đăk Lăk) và thí sinh F0, F1, F2 sẽ dự thi đợt hai, số lượng hơn 26.000.
Thí sinh sẽ làm bài Ngữ văn vào sáng nay trong 120 phút, bắt đầu từ 7h35. Chiều các em thi Toán trong 90 phút, bắt đầu từ 14h30. Ngày 10/8, thí sinh sẽ làm bài thi Khoa học tự nhiên hoặc Khoa học xã hội vào buổi sáng và Ngoại ngữ vào buổi chiều. Kết quả thi được sử dụng để xét công nhận tốt nghiệp THPT và là cơ sở để tuyển sinh đại học.",https://vnexpress.net/bai-dat-nuoc-vao-de-van-thi-tot-nghiep-thpt-4143642.html
49,Ông Nguyễn Đức Chung kiểm tra điểm thi,"Chủ tịch TP Hà Nội Nguyễn Đức Chung yêu cầu theo dõi sát sao sức khỏe thí sinh từ Đà Nẵng về, có thể cho thi riêng và xét nghiệm lại.","7h sáng 8/9, Chủ tịch Nguyễn Đức Chung tới kiểm tra điểm thi tốt nghiệp THPT trường Phan Đình Phùng, quận Ba Đình. Sau khi đo nhiệt độ từ cổng, ông đi từng phòng thi tầng 1, kiểm tra công tác tổ chức, động viên thí sinh. Do không muốn ảnh hưởng đến tâm lý các em, ông không nán lại tại phòng thi lâu, chủ yếu trao đổi với cán bộ và giáo viên tại điểm thi.
Nói chuyện với cán bộ điểm thi, ông Chung ba lần nhấn mạnh ""đây là kỳ thi đặc biệt"". ""Không phải ai trong đời học sinh cũng trải qua cảm giác thi tốt nghiệp trong bối cảnh cả nước đang chống dịch. Chúng ta cần triển khai đồng bộ các biện pháp phòng Covid-19"", ông Chung nói.
Điểm thi trường Phan Đình Phùng có ba thí sinh từ Đà Nẵng trở về, trong đó một em về ngày 24/7, hai em còn lại về từ 20/7, tức 21 ngày tính đến nay. Thí sinh về ngày 24/7 đã được làm xét nghiệm nCoV, kết quả âm tính. Tuy nhiên, để đảm bảo an toàn và tâm lý cho các thí sinh khác, ba em này đã được thi ở phòng riêng.
Chủ tịch Chung cho rằng, cả ba học sinh cần được theo dõi sức khỏe sát sao, đặc biệt là em về Hà Nội ngày 24/7. Dẫn trường hợp F1 tại Bắc Từ Liêm, tiếp xúc trực tiếp với ""bệnh nhân 448"", ông Chung nói: ""Sau hai lần xét nghiệm âm tính, đến lần thứ ba dương tính. Người này từ F1 thành F0 nên chúng ta không được chủ quan, phải theo dõi sát sao, cẩn thận với trường hợp từ Đà Nẵng về. Nếu cần thiết, thi xong có thể xét nghiệm lại cho học sinh này"", ông Chung chỉ đạo.
Về các biện pháp phòng dịch, ông Chung yêu cầu sau mỗi buổi thi, nhà trường phải nhanh chóng tiêu độc, khử trùng chứ không để cả kỳ thi mới làm một lần. Ngoài ra, việc đo nhiệt độ, bố trí nước rửa tay và chuẩn bị sẵn khẩu trang y tế để dự phòng luôn phải đảm bảo sẵn sàng.
Lãnh đạo Hà Nội đề nghị cán bộ, nhân viên tại các điểm thi nhắc nhở phụ huynh không nên tụ tập đông ngoài cổng trường. Sau khi đưa con đến điểm trường, phụ huynh nên ra về để đảm bảo giãn cách, tránh gây cản trở giao thông. ""Chính vì năm nay là kỳ thi đặc biệt, bản thân thí sinh đã gặp rất nhiều lo lắng, chúng ta phải tạo ra môi trường yên lành nhất cho các em làm bài thật tốt"", ông Chung nói.
Năm nay, Hà Nội có hơn 80.000 thí sinh thi tốt nghiệp THPT tại 143 điểm thi. Lần đầu tiên trong lịch sử kỳ thi tốt nghiệp THPT bị lùi một tháng rưỡi và chia làm hai đợt do ảnh hưởng của dịch bệnh. Khoảng 870.000 thí sinh thi đợt một ngày 9-10/8. Những địa phương thực hiện cách ly xã hội như Đà Nẵng, một số nơi ở Quảng Nam, TP Buôn Ma Thuột (Đăk Lăk) và thí sinh F0, F1, F2 sẽ dự thi đợt hai, số lượng hơn 26.000.
Thí sinh sẽ làm bài Ngữ văn vào sáng nay trong 120 phút, bắt đầu từ 7h35. Chiều các em thi Toán trong 90 phút, bắt đầu từ 14h30. Ngày 10/8, thí sinh sẽ làm bài thi Khoa học tự nhiên hoặc Khoa học xã hội vào buổi sáng và Ngoại ngữ vào buổi chiều. Kết quả thi được sử dụng để xét công nhận tốt nghiệp THPT và là cơ sở để tuyển sinh đại học.
Thanh Hằng",https://vnexpress.net/ong-nguyen-duc-chung-kiem-tra-diem-thi-4143625.html
50,Trạm trưởng y tế xã bị đình chỉ công tác do lơ là chống dịch,"Thanh HóaÔng Phạm Thanh Thư, Trạm trưởng y tế xã Thọ Cường, bị đình chỉ chức vụ 30 ngày vì không kịp thời phát hiện, cách ly người tiếp xúc gần với ca mắc Covid-19.","Ông Thư bị Giám đốc Trung tâm Y tế huyện Triệu Sơn ra quyết định trên nhằm phục vụ việc xem xét kỷ luật do thiếu trách nhiệm trong chỉ đạo giám sát, cách ly công dân từ vùng dịch trở về địa phương. Thời hạn đình chỉ một tháng, từ ngày 8/8.
Theo cơ quan chức năng, Trạm Y tế xã Thọ Cường không kịp thời phát hiện một nam thanh niên, 28 tuổi, ở thôn 4 đã trở về địa phương từ 28/7. Trong khi anh này thuộc diện F1 của ""bệnh nhân 620"" và ""bệnh nhân 748"", cần cách ly, giám sát theo quy định.
Ngày 27/7, nam thanh niên đi chung xe khách tuyến Đà Nẵng - Hà Nội cùng hai bệnh nhân trên. Sáng 7/8, anh mới đến Trạm Y tế xã Thọ Cường khai báo y tế, trong khi ngành y tế Thanh Hóa và chính quyền các cấp đều thông báo tìm người đi trên chuyến xe để cách ly, giám sát.
Nam thanh niên hiện cách ly tại Bệnh viện Đa khoa huyện Triệu Sơn. Kết quả xét nghiệm PCR lần một là âm tính.
Từ đợt Covid-19 thứ hai bùng phát đến nay, Thanh Hóa có bốn cán bộ bị đình chỉ công tác, chờ xem xét kỷ luật, gồm ông Sơn và ba người ở xã Quảng Hùng và phường Quảng Vinh, thành phố Sầm Sơn.",https://vnexpress.net/tram-truong-y-te-xa-bi-dinh-chi-cong-tac-do-lo-la-chong-dich-4143671.html
51,Người nghèo Mỹ chết mòn trong Covid-19,Người nghèo tại Mỹ chết dần chết mòn vì Covid-19 do không được tiếp cận y tế cũng như hứng chịu sự phân biệt sắc tộc.,"Hai năm trước, Pamela Rush đi từ hạt Lowndes, Alabama đến thủ đô Washington để điều trần trước một ủy ban của Quốc hội Mỹ về sự nghèo đói và tiền thuê nhà ""như trấn lột"" tại khu vực từ lâu đã khét tiếng về tình trạng bất bình đẳng sắc tộc.
""Họ thu của tôi tới hơn 114.000 USD cho một căn nhà di động xập xệ. Nước thải xả lộ thiên. Tôi không có tiền. Tôi nghèo đói"", Pamela Rush nói trong phiên điều trần.
Một tháng trước, cô qua đời vì Covid-19. Cái chết của Pamela Rush là ""hệ quả của đói nghèo có hệ thống"", theo mục sư William Barber.
Những từ ngữ trên có thể được sử dụng để mô tả về những người nghèo khó tại các hạt nằm sâu ở phía nam nước Mỹ, nơi tiếp cận y tế khó khăn, chính sách sai lầm cũng như chia rẽ và phân biệt sắc tộc kéo dài qua nhiều thế hệ đã khiến tỷ lệ tử vong vì Covid-19 tăng cao vài tháng gần đây.
Trong cơn mưa nặng hạt, Sandy Oliver, một trong những người bạn thân của Rush hồi phổ thông, nhớ lại những người mà cô đã mất trong đại dịch Covid-19. Cô nhẩm đếm trong đầu, rồi ngước nhìn lên trần nhà nơi chiếc quạt cũ kỹ chầm chậm quay. ""Ít nhất là 10 người, tất cả diễn ra chỉ trong vòng tháng rưỡi qua"", Oliver nói.
Hạt Lowndes, miền nam Alabama, là vùng nông thôn thưa thớt người sinh sống với dân số chưa đầy 10.000 người. Dịch Covid-19 lan nhanh tại đây như đám cháy rừng, khiến Lowndes trở thành tâm dịch của toàn bang và điểm nóng trên cả nước.
Cứ 18 người dân tại đây lại có một người mắc Covid-19, tỷ lệ cao nhất trên toàn Alabama và nằm trong số các địa phương có tỷ lệ cao nhất trên toàn nước Mỹ. 72% dân số của hạt là người Mỹ gốc Phi.
Oliver quen biết hầu hết trong số 24 người chết vì Covid-19 tại Lowndes. Chỉ vài ngày trước, lễ tưởng niệm dành cho Rush đã được tổ chức tại một nhà tang lễ tuân thủ đúng quy định giãn cách xã hội. ""Tôi cảm thấy rất tệ bởi tôi hiểu rằng, điều này cũng có thể xảy ra với tôi. Tôi rất thương cảm cho cô ấy và cả hai đứa con của cô"", Oliver nói.
Đối với nhiều cộng đồng dân cư ở sâu trong phía nam nước Mỹ, câu chuyện về chết chóc, mất mát và đau khổ vì Covid-19 được cho là bắt nguồn từ những vấn đề ăn sâu bén rễ từ lâu.
Hàng thập kỷ trước, hạt này đã được gọi là ""Lowndes đẫm máu"" vì nạn giết chóc người da màu vô tội vạ, coi người da trắng là thượng đẳng cũng như tội ác của băng đảng KKK. Năm 1965, đoàn người biểu tình đòi quyền bỏ phiếu cho người da màu do linh mục Martin Luther King và John Lewis đã diễu hành qua hạt này trên đường đến Montgomery.
Tuy nhiên, 55 năm sau, bất bình đẳng về kinh tế vẫn chưa được giải quyết. Hơn 30% dân số ở đây sống trong đói nghèo khiến Lowndes trở thành một trong những hạt nghèo nhất bang Alabama.
Thậm chí ở đây còn không có bệnh viện và những người như Oliver hay Rush phải đi xa hàng chục km nếu muốn được chữa bệnh. Kết quả điều tra dân số cho thấy, ít nhất 12% người dân không có bảo hiểm y tế dưới bất kỳ hình thức nào.
Dù chính quyền Trump đã cam kết hỗ trợ cho các bệnh viện chấp nhận điều trị Covid-19 cho bệnh nhân không có bảo hiểm y tế, sự kỳ thị xã hội và nỗi lo không được chi trả bảo hiểm chính thức khiến nhiều người không dám tìm đến sự trợ giúp y tế.
Khi Rickey Lewis, con rể của Oliver, mắc Covid-19 dẫn đến viêm phổi, mê sảng và sốt cao, anh không dám gọi xe cứu thương mà tự lái xe đến bệnh viện. Anh không có bảo hiểm và lo lắng việc phải trả tiền xe cứu thương. Lewis cho biết khi xe đến bệnh viện, anh thậm chí không thể tự đi được nữa mà phải nhờ người chuyển vào bên trong.
Lewis nằm tại bệnh viện Vaughan Regional 4 ngày trước khi được ra viện. Dù vẫn còn có những dấu hiệu của bệnh, anh vẫn tự lái xe về nhà để tránh nguy cơ bị phạt tiền. ""Tôi có niềm tin rằng mình sẽ sống sót"", Lewis chia sẻ sau khi đã khỏi bệnh hoàn toàn.
Tuy nhiên, vợ anh, Quanita lại không mấy tin tưởng vào điều này. ""Thật tệ khi bạn phải tự lê mình đến bệnh viện khi bạn bị ốm"", Quanita nói và kể lại việc cô đã phát khóc khi gọi điện cho mẹ khi tình trạng của Lewis trở nên tồi tệ hơn. ""Tôi không nghĩ rằng mình đang sống ở quốc gia giàu nhất thế giới bởi chúng tôi thực sự đang rất khó khăn"", Quanita nói thêm.
Trong khi đó, tại hạt Leflore, bang Mississippi, bác sĩ Rachael Faught không giấu nổi sự mệt mỏi. Bà là một trong hai bác sĩ hồi sức cấp cứu duy nhất tại bệnh viện Greenwood Leflore điều trị cho rất nhiều bệnh nhân tại các hạt ở khu vực nông thôn của bang. Trong vòng một tháng qua, số ca nguy kịch vì Covid-19 tại đây tăng mạnh khiến bệnh viện luôn trong tình trạng quá tải.
Faught đã tận mắt chứng kiến ba thành viên trong một gia đình tử vong vì Covid-19. Trong những tuần gần đây, khi làn sóng dịch bệnh thứ hai quét qua bang này, cả 12 giường trong phòng hồi sức cấp cứu đều có bệnh nhân và một vài người đã được đưa sang bang khác để điều trị. Những ca bệnh nặng chủ yếu là người da màu.
""Cảm xúc của chúng tôi thay đổi như chong chóng. Có lúc tôi thấy sẵn sàng làm việc và rất muốn chăm sóc cho người bệnh vì tôi được đào tạo để làm điều này. Tuy nhiên, có những lúc tôi cảm thấy thất vọng, đặc biệt là khi có quá nhiều người thiệt mạng"", Faught nói.
Dù đã quen dần với việc điều trị bệnh nhân Covid-19 và đạt một số thành công trong khi sử dụng thuốc remdesivir, nhưng cũng giống như các bệnh viện ở nông thôn của Mỹ, Greenwood Leflore gặp khó khăn về tài chính và vẫn thiếu nhiều trang thiết bị bảo hộ y tế. Các nhân viên y tế buộc phải tái sử dụng khẩu trang, quần áo bảo hộ.
Greenwood, nằm bên bờ sông Yazoo, là thành phố lớn nhất của hạt Leflore và có truyền thống đấu tranh vì dân quyền. Năm 1966, trước đám đông gần 3.000 người, Stokely Carmichael đã đề cập đến cụm từ ""Quyền lực của người da màu"" trong bài phát biểu sau khi ông bị bắt giữ trong ""Cuộc tuần hành chống lại sự sợ hãi"" từ Memphis đến Jackson.
Đứng tại tòa thị chính, nơi ông bà của mình từng bị từ chối quyền được bỏ phiếu, Tavaris Cross so sánh những gì đã xảy ra trong quá khứ với tình hình dịch bệnh hiện nay. ""Đã có những sự thay đổi nhưng rất nhiều thứ vẫn vậy. Thu nhập của chúng tôi vẫn thấp, điều kiện sống cực kỳ tồi tệ, hệ thống trường học nghèo nàn và hệ thống chăm sóc y tế cần được cải thiện nhiều"".
Cách đó không xa là một bức tượng Liên minh miền Nam được dựng lên từ năm 1913. Sau quyết định gần đây của bang Mississippi về việc dỡ bỏ lá cờ của Liên minh miền Nam ra khỏi quốc kỳ bang, hạt Leflore cũng đã bỏ phiếu thông qua việc kéo đổ bức tượng này.
Dù có vui, Cross vẫn tỏ ra thận trọng về hệ lụy lâu dài của nó trong vấn đề sắc tộc ở Greenwood. ""Quyết định này là con dao hai lưỡi bởi những người da trắng chủ yếu là chủ. Bức tượng này đại diện cho lịch sử và di sản của họ"".
Là người tổ chức Poor People’s Campaign (Chiến dịch cho Người nghèo), Cross từng làm việc với nhiều người may mắn sống sót sau khi mắc Covid-19, trong đó có Patrick Ivory, người mất việc làm sau khi xin nghỉ ốm.
Ivory liệt kê hàng loạt những triệu chứng mà anh gặp phải trong một tháng qua, gồm viêm phổi và sốt cao tới 40 độ C. ""Cơ thể tôi như bốc lửa"", Ivory nói và kể lại việc vợ anh Davuchi chườm đá lên người anh và nó bốc hơi ngay lập tức.
Ivory đã phải nằm ở phòng hồi sức cấp cứu khi nồng độ oxy trong máu của anh tụt mạnh. Sau đó anh được đưa về nhà nhưng vẫn phải thở oxy. Phải hai tuần sau triệu chứng bệnh của anh mới suy giảm. Tuy nhiên, đến lúc đó, các chủ lao động đã quyết định chấm dứt hợp đồng với anh và anh không thể kê khai nhận bảo hiểm thất nghiệp.
""Anh ấy làm rất tốt nhưng sau khi anh ấy mắc bệnh, họ lại không còn muốn dính dáng gì đến chúng tôi nữa"", cô Davuchi nói.
Khánh An (Theo Guardian)",https://vnexpress.net/nguoi-ngheo-my-chet-mon-trong-covid-19-4142252.html
52,Australia bắt người Việt trộm nhiều hàng hiệu,"Cảnh sát Australia bắt Trung Bao Le, một thanh niên người Việt nổi tiếng trên mạng xã hội về thời trang, với cáo buộc trộm nhiều túi xách hàng hiệu.","Cảnh sát bắt Trung Bao Le, 25 tuổi, hôm 7/8 tại thành phố Sydney, trước khi khám xét nhà của thanh niên này và phát hiện nhiều túi xách đắt tiền. Họ cáo buộc số túi xách trị giá 50.000 AUD (gần 36.000 USD, 830 triệu đồng) thuộc các thương hiệu xa xỉ như Dior, Bally, Chloe, Louis Vuitton, được anh này đánh cắp từ các cửa hàng cao cấp ở Sydney và Melbourne.
Trung thường xuyên khoe bộ sưu tập túi xách hàng hiệu trên tài khoản Instagram có hơn 50.000 người theo dõi. Trung, người tốt nghiệp ngành kinh doanh thời trang, đã ra tòa hôm 8/8.
Luật sư Paul Johnson thừa nhận thân chủ của mình ""mê muội"" thời trang, là người có ảnh hưởng trên mạng và được hình dung sở hữu những ""tài sản đắt tiền"". Luật sư cũng nói rằng Trung mắc chứng ""nghiện không thể kiểm soát"" đối với đồ thiết kế riêng. Ông lập luận vì toàn bộ số túi đã bị tịch thu nên Trung được tại ngoại và anh ta đang rất hoảng loạn về những gì đã xảy ra.
Cơ quan công tố kiên quyết phản đối đơn xin tại ngoại của Trung.
""Nếu đây gần như là một sự tôn sùng thì làm thế nào chúng ta đối phó được với một người nghiện loại hành vi này?"", thẩm phán Chris McRobert hỏi bị cáo, nhận xét đó là ""nỗi ám ảnh không thể kiểm soát được"".
""Nếu các ông cho tôi tại ngoại, tôi sẽ xóa tài khoản Instagram, mạng xã hội, xóa mọi thứ"", Trung nói.
Thẩm phán McRobert chấp nhận đề nghị và cho Trung tại ngoại với loạt điều kiện nghiêm ngặt cấm anh ta sử dụng mạng xã hội và vào các cửa hàng bán lẻ. Trung cũng đã được yêu cầu trình diện cảnh sát hàng ngày.
Vụ án sẽ tiếp tục được xét xử vào ngày 14/8 tại tòa án địa phương.
Huyền Lê (Theo Daily Telegraph)",https://vnexpress.net/australia-bat-nguoi-viet-trom-nhieu-hang-hieu-4143657.html
53,Nữ tiếp viên karaoke bị khống chế đưa lên ôtô,"An GiangNhận lệnh chủ quán karaoke ở Tây Ninh, tài xế Lưu Văn Bình lái ôtô chở nhóm nữ tiếp viên đến TP Long Xuyên khống chế cô nhân viên kiêm con nợ.","Theo điều tra ban đầu, giữa tháng 3, cô gái 24 tuổi ở TP Long Xuyên được Nguyễn Thị Trúc Linh (25 tuổi) giới thiệu cùng làm tiếp viên quán karaoke ở thị xã Trảng Bàng, Tây Ninh.
Thời gian làm việc tại đây, cô vay bà chủ 55 triệu đồng với lãi suất 5,5 triệu/tháng, đã trả 29 triệu cả vốn lẫn lãi. Ngày 31/7, cô được Linh bảo lãnh cho nghỉ hai ngày để về thăm nhà. Lấy lý do mẹ bệnh, cô nhắn tin xin bà chủ cho nghỉ làm nhưng không được đồng ý.
Tối 4/8, chủ quán karaoke được cho là kêu tài xế Bình chở 4 nữ nhân viên đến TP Long Xuyên truy tìm cô này. Chiều hôm sau cả nhóm được sự hỗ trợ của Linh, tìm thấy ""con nợ"" đang đi chơi với bạn trai nên khống chế, đưa lên ôtô chở về Tây Ninh. Sự việc được báo cho công an.
Khi Bình lái xe về đến Tây Ninh thì bị cảnh sát tạm giữ.
Công an TP Long Xuyên đang làm rõ dấu hiệu phạm tội Bắt giữ người trái pháp luật đối với Bình, 4 nữ tiếp viên và những người liên quan.
Cửu Long",https://vnexpress.net/nu-tiep-vien-karaoke-bi-khong-che-dua-len-oto-4143696.html
54,"Hỗn chiến trong quán ốc, một người chết","TP HCMVa quẹt trong lúc đi vệ sinh, Vũ Ngọc Long, 35 tuổi, quê Hà Nội, xảy ra mâu thuẫn với nhân viên quán ốc và bị người này đâm chết.","Long ngồi nhậu cùng bốn người bạn tại quán ốc trên đường Lê Trọng Tấn, quận Tân Phú, rạng sáng 6/8. Trong lúc đi vệ sinh, Long va quẹt với Phan Minh Đức, 27 tuổi, quê Tây Ninh, là nhân viên của quán.
Long trách người này đụng mình nhưng không xin lỗi nên hai bên xảy ra cự cãi. Nam nhân viên về bàn tiếp tục nhậu với các đồng nghiệp sau giờ làm.
Sau đó Long cầm chai bia sang đập vào đầu Đức. Các bạn của anh ta cũng lao đến dùng bàn ghế tấn công nhóm nhân viên.
Trong lúc hỗn chiến, Nguyễn Văn Giang, 24 tuổi, quê Đồng Tháp, lấy con dao trong bếp đâm Long tử vong.
Sáng 9/8, Công an quận Tân Phú đã bắt Giang cùng hai người khác để điều tra hành vi Giết người.
Đình Văn",https://vnexpress.net/hon-chien-trong-quan-oc-mot-nguoi-chet-4143675.html
