,Title,Descr,Content,URL
0,'Bệnh nhân 812' dương tính sau hai lần âm tính,"Hà NộiBệnh nhân 62 tuổi, ca mới nhất mắc Covid-19 của thành phố là nhân viên giao hàng tại tiệm bánh pizza 106 Trần Thái Tông, đã hai lần xét nghiệm PCR âm tính.","Thông tin trên được Giám đốc Sở Y tế Nguyễn Khắc Hiền đưa ra tại cuộc họp Ban chỉ đạo phòng, chống dịch Covid-19 thành phố Hà Nội, sáng 9/8.
Theo ông Hiền, nam ""bệnh nhân 812"" làm cùng tại cửa hàng với ""bệnh nhân 447"" và có tiếp xúc gần.
Ngày 29/7, ông được Trung tâm y tế quận Bắc Từ Liêm lấy mẫu xét nghiệm PCR lần một, kết quả âm tính. Ông sau đó cách ly tại Bệnh viện Công an thành phố.
Ngày 3/8, ông sốt, mệt mỏi và chuyển đến Bệnh viện Thanh Nhàn để cách ly, điều trị. Ngày 4/8, ông được bệnh viện lấy mẫu xét nghiệm PCR lần hai, âm tính.
Ngày 7/8, các triệu chứng tăng lên, bệnh nhân tiếp tục xét nghiệm lần ba. Mẫu gửi Trung tâm kiểm soát bệnh tật (CDC Hà Nội). Ngày 8/8, CDC Hà Nội thông báo kết quả dương tính.
Phó giám đốc CDC Hà Nội Khổng Minh Tuấn cho hay từ việc này cho thấy thành phố đã xuất hiện ca bệnh thuộc thế hệ thứ hai liên quan yếu tố Đà Nẵng. ""Bệnh nhân 447"" là thế hệ thứ nhất. ""Thực tế trên đã cảnh báo nguy cơ cho tất cả trường hợp trở về từ Đà Nẵng"", ông nói.
Bí thư quận Bắc Từ Liêm Trần Thế Cương nói ""bệnh nhân 812"" là một trong 9 trường hợp F1 của ""bệnh nhân 447"" trên địa bàn quận. Bốn trường hợp F2 của bệnh nhân này thành F1 gồm: vợ, con trai, con gái đang mang bầu và con rể. Quận đã đưa bốn người đi cách ly tập trung và lấy mẫu xét nghiệm. Khu vực bệnh nhân sinh sống được phun khử khuẩn, cảnh báo người dân hạn chế đi lại.
Chủ tịch UBND Hà Nội Nguyễn Đức Chung cho biết, giai đoạn 3 (tính từ khi phát hiện ca bệnh tại Đà Nẵng ngày 25/7) Hà Nội ghi nhận bảy ca bệnh, gồm cả ca 712 Bộ Y tế công bố ở Hải Dương, nhưng có lịch sử dịch tễ chủ yếu ở Hà Nội. Ca thứ bảy, ""bệnh nhân 812"", được cho là phức tạp, là trường hợp thứ phát, lây từ ""bệnh nhân 447"".
Trước việc này, ông Chung yêu cầu phải tiến hành song song nhiều biện pháp, ""chạy đua"" với thời gian. Chậm nhất ngày 20/8, Hà Nội lấy mẫu xong số người từ Đà Nẵng trở về từ 15/7 đến nay.
Thành phố sẽ tập trung truy tìm F1, F2 của tất cả bệnh nhân trên địa bàn. Bệnh nhân đã được thông báo ở các tỉnh, địa phương khác nhưng liên quan Hà Nội hoặc người Hà Nội tiếp xúc gần với các bệnh nhân này thì coi như F1.
""Tất cả F1 phải cách ly tập trung và lấy mẫu xét nghiệm PCR. F2 cách ly tại nhà, sau đó lấy mẫu xét nghiệm"", Chủ tịch Hà Nội nói và cho biết các trường hợp F1 phải lấy mẫu ít nhất hai lần, khi vào nơi cách ly tập trung và lúc ra.
Công an thành phố được giao tuần tra, nhắc nhở, xử lý nghiêm các trường hợp không đeo khẩu trang nơi công cộng.
""Từ nay đến 15-20/8 sẽ là những ngày cao điểm, có thể phát hiện thêm các ca bệnh mới khi thành phố đang tổ chức xét nghiệm cho gần 100.000 người từ Đà Nẵng trở về. Người dân cần hết sức bình tĩnh, không chủ quan nhưng cũng không quá lo lắng"", Chủ tịch Hà Nội nói.
Đến sáng 9/8, tổng số ca nhiễm cả nước là 812, trong đó 395 người đã khỏi, 10 ca tử vong, 407 bệnh nhân đang điều trị.
Số ca nhiễm mới trong cộng đồng tính từ ngày 25/7 đến nay là 355, ghi nhận tại 13 tỉnh, thành phố và đều có yếu tố dịch tễ liên quan tới ổ dịch Đà Nẵng.
Võ Hải",https://vnexpress.net/benh-nhan-812-duong-tinh-sau-hai-lan-am-tinh-4143649.html
1,Đối lập trong cách tranh cử của Trump và Biden,Trong khi nhóm vận động tranh cử của Trump gõ hơn một triệu cánh cửa trong vòng một tuần qua thì nhóm của Biden không gõ cửa nhà nào.,"Sự khác biệt này không chỉ diễn ra giữa hai ứng viên tổng thống Mỹ trong cuộc bầu cử năm 2020 mà còn của cả hai đảng Cộng hoà và Dân chủ. Cả hai đều đang chơi ""canh bạc tất tay"" trong cách nhìn nhận giá trị của việc trực tiếp vận động tranh cử trong đại dịch Covid-19, vốn chưa từng có tiền lệ trong thời hiện tại. Đây cũng có thể là ""lá bài bất ngờ"" quyết định kết quả cuộc bầu cử tổng thống sít sao như hiện nay.
Biden và Ủy ban Quốc gia đảng Dân chủ quyết định không cử tình nguyện viên hay nhân viên của mình đến vận động cử tri tại nhà riêng và cũng không tham gia bất kỳ hoạt động nào ngoài việc rải tờ rơi cho đến khi dịch bệnh suy giảm.
Cả nhóm vận động tranh cử và Ủy ban Quốc gia đảng Dân chủ đều cho rằng họ có thể bù đắp bằng cách gọi điện, nhắn tin, sử dụng các dạng thức tổ chức hội họp mới và gặp mặt trên mạng với cử tri.
""Ban đầu tôi cảm thấy hồi hộp, nhưng tỷ lệ trả lời các cuộc điện thoại và tin nhắn của chúng tôi rất cao và cử tri cũng không muốn có ai xuất hiện trước cửa nhà vào thời điểm này. Bạn sẽ phải bỏ qua rất nhiều quy định cũ và thử tìm cách mới"", Jenn Ridder, giám đốc vận động tranh cử tại các bang của Biden, chia sẻ.
Trong khi đó, Trump và Ủy ban Quốc gia đảng Cộng hoà từ tháng 6 đã bắt đầu triển khai các nhân viên và tình nguyện viên đeo khẩu trang xuống phố. Đảng Cộng hoà nhanh chóng đẩy nhanh quá trình này và cho biết mỗi tuần, các nhân viên và tình nguyện viên gõ cửa hơn một triệu nhà, bất chấp dịch Covid-19 gia tăng nhanh chóng, nhất là tại các bang chiến trường như Arizona.
Đảng Cộng hoà cho rằng chiến lược gõ cửa từng nhà của họ sẽ tạo ra khác biệt vào tháng 11 bởi đây được cho là cách thức hiệu quả nhất để liên hệ với cử tri.
""Từ giờ đến ngày bầu cử, cử tri sẽ chỉ nhận thấy nhóm vận động tranh cử từ một đảng có mặt trước cửa nhà. Nếu đây là cuộc vận động tranh cử của Barack Obama, đảng Dân chủ sẽ muốn ra ngoài gõ cửa từng nhà. Nhưng giờ họ không còn có đủ sự tích cực cũng như nhóm hoạt động trên thực địa đủ mạnh. Vì thế, Covid-19 là lời biện hộ thích hợp. Chúng tôi hoàn toàn có thể thực hiện kiểu an toàn như thế này cho Tổng thống Trump và cả đảng Cộng hoà"", Elliott Echols, giám đốc vận động tranh cử của Ủy ban Quốc gia đảng Cộng hoà, nói.
Cả hai nhóm vận động tranh cử của Trump và Biden đều đã đổ hàng triệu USD vào chương trình vận động tranh cử. Trump Victory có tới 1.500 nhân viên làm việc toàn thời gian tại 23 bang.
Các nhân viên này đều được yêu cầu đọc cuốn ""Groundbreakers: How Obama's 2.2 Million Volunteers Transformed Campaigning in America"" (Những người tiên phong: Cách thức 2,2 triệu tình nguyện viên của Obama thay đổi chiến dịch vận động tranh cử ở Mỹ). Cuốn sách phân tích kỹ lưỡng cách thức vận động của Obama năm 2008 và 2012. Đảng Cộng hòa dự kiến bổ sung khoảng 1.000 nhân viên vào cuối tháng 9 để tập trung vận động trực tiếp.
Trong khi đó, nhóm vận động của Biden lại tỏ ra chậm chạp sau cuộc bầu cử sơ bộ. Các vị trí cao cấp cho các bang quan trọng như Florida và Pennsylvania chỉ được công bố vào tháng 7 và đến cuối tháng 6, nhóm này mới tuyển được 600 nhân viên. Tuy nhiên, nhóm cho biết sẽ tăng số lượng nhân viên lên 2.000 người vào cuối tháng 8 thông qua sự điều phối với Ủy ban Quốc gia đảng Dân chủ.
Các nhà khoa học chính trị vẫn bất đồng về hình thức vận động bầu cử dù đều cho rằng điều này có thể tác động đến kết quả của cuộc chạy đua sít sao. Những người điều hành các chương trình vận động tranh cử cho rằng điều này thậm chí càng quan trọng hơn trong mùa thu này khi nhu cầu bỏ phiếu qua thư tăng vọt.
Nhắc nhở các cử tri đi bỏ phiếu và sau đó thu thập kết quả (hay còn gọi là ""bắt phiếu"") là một trong những hoạt động quan trọng nhất trong bất kỳ chiến dịch tranh cử nào. Nhóm vận động của Biden cho biết nhiều khả năng sẽ không thu thập kết quả trực tiếp. Nhưng họ vẫn lạc quan sẽ triển khai hiệu quả việc này thông qua điện thoại, tin nhắn và viện dẫn thành công tại Wisconsin vào mùa xuân trong cuộc chạy đua vào Toà án Tối cao bang.
Dù vậy, chiến lược đã trực tiếp tác động đến Biden. Ông bị Trump mỉa mai là vận động tranh cử từ tầng trệt nhà mình dù sau đó Biden tích cực xuất hiện trước công chúng hơn.
""Chính trị, mà cụ thể là các cuộc vận động tranh cử, là dạng thức markerting cuối cùng vẫn tận dụng tối đa việc gõ cửa từng nhà. Các tiếp cận của Trump là quá cổ điển và tôi nghĩ rằng nhóm vận động của Biden sẽ làm theo cách này nếu họ không buộc phải suy nghĩ khác đi vì họ hành động có trách nhiệm trong dịch bệnh"", Michael Halle, cựu cố vấn cao cấp cho chiến dịch tranh cử tổng thống của Pete Buttigieg, chia sẻ.
Những người ủng hộ đảng Dân chủ đang cảm thấy bất an và giận dữ với sự bất cẩn của những người ủng hộ đảng Cộng hoà. Uỷ ban Vận động Bầu cử Quốc hội đảng Dân chủ cho biết nhân viên của họ được đào tạo để không vận động trực tiếp.
Các tiếp cận khác biệt giữa hai bên cũng rất rõ rệt trong cuộc đua tại địa phương. Ngay cả ở Montana, nơi dân cư thưa thớt và tỷ lệ nhiễm Covid-19 khá thấp, đảng Cộng hoà gõ cửa vận động ủng hộ cho Thượng nghị sĩ Steve Daines trong khi đảng Dân chủ lại không làm vậy với Thống đốc Steve Bullock vì chính sách của ông chủ yếu tập trung vào chống dịch.
Ủy ban Quốc gia đảng Cộng hoà từ chối tiết lộ liệu các nhân viên và tình nguyện viên có được xét nghiệm Covid-19 hay không nhưng cho biết họ đều được cung cấp tài liệu dày 8 trang với các chỉ dẫn của Trung tâm Kiểm soát và Phòng ngừa Dịch bệnh Mỹ. Họ cũng cung cấp khẩu trang cho những người đi vận động và khuyến khích họ đứng lùi lại vài bước sau khi đã gõ cửa. Họ đã chi hơn 100.000 USD để mua các thiết bị bảo hộ y tế và vệ sinh văn phòng.
""Tôi nghĩ hoàn toàn có thể làm điều này một cách có trách nhiệm, tuy nhiên không phải là ở các bang dịch bệnh đang hoành hành. Nếu có ai đó xuất hiện ở ngoài cửa nhà bạn, đứng cách nhà khoảng hai mét và đeo khẩu trang cùng găng tay và nước diệt trùng, hoàn toàn có thể chấp nhận được theo chỉ dẫn. Dù vậy, việc vận động vẫn có thể tiến hành qua mạng. Đó là lựa chọn tốt nhất vào thời điểm này"", bác sĩ Howard Koh, cựu trợ lý Bộ trưởng Y tế dưới thời chính quyền Tổng thống Obama, nói.
Khác biệt trong cách vận động tranh cử là dấu hiệu rõ ràng cho thấy nỗ lực ứng phó với cuộc khủng hoảng y tế công tại Mỹ đang bị chính trị cản trở. Phe Cộng hoà không mấy ủng hộ bắt buộc đeo khẩu trang và cảm thấy thoải mái hơn khi đến những nơi công cộng như nhà hàng và khách sạn so với phe Dân chủ. Rất nhiều nghị sĩ đảng Cộng hoà đứng sau ủng hộ các chủ kinh doanh nhỏ lẻ từng vi phạm lệnh phong toả. Trong khi đó, các thống đốc và nghị sĩ đảng Dân chủ lại tỏ ra nghiêm khắc tuân thủ lệnh phong toả và quy định đeo khẩu trang hơn, dù phe Cộng hoà cho rằng những biện pháp này còn gây ra nhiều vấn đề hơn bản thân dịch bệnh.
Sự chia rẽ này đã khiến việc triển khai người đến gõ cửa từng nhà trong chiến dịch của đảng Dân chủ trở nên bất khả thi ngay cả khi họ muốn làm như vậy.
Progressive Turnout Project (PAC), một siêu Ủy ban hành động chính trị theo xu hướng tự do đã thuê hàng trăm người tham gia vận động trực tiếp tại các bang chiến trường trong năm nay và triển khai lực lượng từ mùa hè. Tuy nhiên, Ủy ban này đã nhanh chóng vấp phải sự phản đối sau khi một nhân viên được xác nhận dương tính với Covid-19 và một nhóm nhân viên cấp thấp khác biểu tình phản đối do lo ngại về sức khoẻ.
Tuần trước, Ủy ban này phải dừng mọi hoạt động vận động gõ cửa từng nhà và cho biết khoảng 1.200 nhân viên của họ làm việc tại 17 bang trên toàn nước Mỹ sẽ tập trung gọi điện thoại, nhắn tin và ""các công việc liên quan đến tổ chức khác"".
""Chúng tôi hy vọng rằng tình hình dịch bệnh sẽ được cải thiện để các thành viên có thể quay trở lại vận động trực tiếp. Nhưng giờ an toàn là trên hết"", Alex Morgan, giám đốc điều hành Ủy ban, nói.
Khánh An (Theo Politico)",https://vnexpress.net/doi-lap-trong-cach-tranh-cu-cua-trump-va-biden-4141902.html
2,Gợi ý làm bài môn Ngữ văn thi tốt nghiệp THPT,"Đề Văn tốt nghiệp THPT sáng 9/8 gồm hai phần là Đọc hiểu và Làm văn với những dạng câu hỏi quen thuộc, không làm khó thí sinh.","PHẦN I: ĐỌC HIỂU
Câu 1: Phương thức biểu đạt chính được sử dụng trong đoạn trích là nghị luận.
Câu 2: Các loài thực vật ở vùng Tsunoda thuộc Bắc cực đua nhau nảy mầm, nở thật nhiều hoa, kết hạt, chen chúc vươn mình trong khoảng không với mảnh đời thật ngắn ngủi giữa mùa hè.
Câu 3: Sự tương đồng về sự sống của các loài thực vật ở vùng Tsunoda ở Bắc cực và ở vùng sa mạc Sahara trong đoạn trích: Dù sống trong điều kiện khắc nghiệt với vòng đời ngắn ngủi, các loài thực vật vẫn nảy mầm, đơn hoa, kết hạt và gieo mầm sự sống cho thế hệ sau.
Câu 4: 
Học sinh nêu rõ quan điểm, suy nghĩ cá nhân. Cần lý giải thuyết phục, hợp lý. Sau đây là gợi ý:
- Tương lai được tạo nên từ quá khứ và hiện tại. Bởi vậy, sống hết mình ở hiện tại chính là tiền đề để tạo nên một tương lai tốt đẹp, dù là nhỏ bé.
- Mỗi giây phút trôi qua đều quý giá. Những giây phút sống hết mình sẽ mang lại cho con người những kinh nghiệm vô giá, những trải nghiệm đáng quý và trở thành hành trang đưa con người đến tương lai.
PHẦN II: LÀM VĂN
Câu 1: Từ nội dung đoạn trích ở phần Đọc hiểu, anh/chị hãy viết một đoạn văn (khoảng 200 chữ) trình bày suy nghĩ của bản thân về sự cần thiết phải trân trọng cuộc sống mỗi ngày.
1. Đảm bảo yêu cầu về hình thức đoạn văn (0,25 điểm)
- Viết thành đoạn văn (khoảng 200 chữ).
- Có thể trình bày đoạn văn theo cách diễn dịch, quy nạp, tổng-phân-hợp, móc xích hoặc song hành.
2. Xác định đúng vấn đề cần nghị luận (0,25 điểm)
Sự cần thiết phải trân trọng cuộc sống mỗi ngày.
3. Triển khai vấn đề nghị luận (1,0 điểm)
Thí sinh lựa chọn các thao tác lập luận phù hợp để triển khai vấn đề nghị luận theo nhiều cách nhưng phải làm rõ sự cần thiết của việc phải trân trọng cuộc sống mỗi ngày. Có thể theo hướng sau:
- Giải thích: Trân trọng cuộc sống mỗi ngày là thái độ quý trọng, nâng niu, tận dụng mọi khoảnh khắc của hiện tại, không bỏ phí dù chỉ một giây phút nhỏ bé.
- Sự cần thiết phải trân trọng cuộc sống mỗi ngày:
+ Mỗi ngày là một phần tạo nên dòng chảy dài của cuộc sống. Trân trọng cuộc sống mỗi ngày giúp ta hiểu được ý nghĩa của từng điều nhỏ bé để tạo nền tảng vững chắc cho tương lai.
+ Trân trọng cuộc sống mỗi ngày giúp con người sống trọn vẹn trong từng khoảnh khắc, sống có ý nghĩa.
+ Trân trọng cuộc sống mỗi ngày là thái độ sống tích cực, chỉ những người biết trân trọng từng khoảnh khắc, tận dụng nó mới có thể tạo nên thành công.
4. Chính tả, ngữ pháp (0,25 điểm)
Đảm bảo chuẩn chính tả, ngữ nghĩa, ngữ pháp tiếng Việt.
5. Sáng tạo (0,25 điểm)
Có cách diễn đạt mới mẻ, thể hiện suy nghĩ sâu sắc về vấn đề nghị luận.
Câu 2: Phân tích tư tưởng ""Đất Nước của Nhân dân"" được nhà thơ Nguyễn Khoa Điềm thể hiện trong đoạn thơ.
1. Đảm bảo cấu trúc bài văn nghị luận (0,25 điểm)
Mở bài giới thiệu được vấn đề. Thân bài triển khai được vấn đề. Kết bài khái quát được vấn đề.
2. Xác định đúng vấn đề cần nghị luận (0,5 điểm)
Tư tưởng ""Đất Nước của Nhân dân"" được thể hiện trong đoạn thơ.
3. Triển khai vấn đề nghị luận thành các luận điểm
a. Giới thiệu khái quát về tác giả Nguyễn Khoa Điềm, trường ca Mặt đường khát vọng và đoạn trích (0,5 điểm)
b. Triển khai hệ thống luận điểm (3,5 điểm)
* Giải thích: Tư tưởng ""Đất Nước của Nhân dân"" thể hiện quan niệm, suy nghĩ sâu sắc của nhà thơ về đất nước: gắn đất nước với công lao của những người dân vô danh.
* Biểu hiện tư tưởng ""Đất Nước của Nhân dân"":
- Lịch sử 4.000 năm của dân tộc được tạo nên từ mồ hôi và xương máu của nhân dân:
+ Họ là những người con trai, con gái bình dị nhưng thường trực tình yêu nước, vừa hăng say lao động, vừa dũng cảm chiến đấu.
+ Tác giả đề cao vai trò của những con người vô danh làm nên lịch sử.
- Nhân dân đóng vai trò chủ thể trong công cuộc xây dựng và bảo vệ đất nước:
+ Nhân dân là những người đã làm ra, giữ gìn và sáng tạo những giá trị vật chất, tinh thần, văn hóa cho đất nước: ""truyền hạt lúa"", ""chuyền lửa"", ""truyền giọng nói"", ""gánh theo tên xã, tên làng""...
+ Họ chiến đấu với ngoại xâm và nội thù để bảo vệ đất nước.
- Tư tưởng ""Đất Nước của Nhân dân"" của Nguyễn Khoa Điềm có sự kế thừa và phát triển trong thời đại mới, thời đại chống Mỹ cứu nước.
* Nghệ thuật
- Thể loại trường ca với các câu thơ dài ngắn đan xen.
- Sử dụng nhuần nhuyễn và sáng tạo các chất liệu văn hóa dân gian.
- Giọng điệu thiết tha, thủ thỉ.
- Cách viết hoa ""Đất Nước"", ""Nhân dân"".
4. Chính tả, ngữ pháp (0,25 điểm)
Đảm bảo chuẩn chính tả, ngữ nghĩa, ngữ pháp tiếng Việt.
5. Sáng tạo (0,5 điểm)
Có cách diễn đạt mới mẻ, thể hiện suy nghĩ sâu sắc về vấn đề nghị luận.
Hệ thống giáo dục HOCMAI",https://vnexpress.net/goi-y-lam-bai-mon-ngu-van-thi-tot-nghiep-thpt-4143658.html
