,Title,Descr,Content,URL
85,Bộ đôi xe máy Kymco 50cc cho học sinh,"Hai dòng xe máy Candy Hermosa 50cc và Like 50cc thiết kế hiện đại, dễ dàng sử dụng, giá cả hợp lý, phù hợp cho giới học sinh, sinh viên.","Theo đại diện Kymco, các mẫu xe 50cc trên thị trường hiện tại được cải tiến chất lượng, vận hành mạnh mẽ. Trong khi đó, giá xe ở mức vừa phải, giúp các bậc phụ huynh tiết kiệm chi phí khi mua xe cho con đi học, phục vụ tốt nhu cầu đi lại trong thành phố. Ngoài ra những bà nội trợ hay người cao tuổi nếu cần chạy xe đi chợ hay đi chơi cũng thoải mái, tiết kiệm xăng và đảm bảo an toàn. Đây cũng là lý do mà Kymco tung ra hai mẫu xe mới Candy Hermosa 50cc và Like 50cc với nhiều tính năng hiện đại, tiện dụng.
Ngoài ra, Candy Hermosa 50cc còn có nhiều ưu điểm như cốp rộng, đựng được hai mũ bảo hiểm và nhiều đồ dùng khác, nắp bình xăng đặt phía trước tiện lợi, hệ thống ổ khóa đa năng, mặt đồng hồ dễ theo dõi thông tin và sàn để chân thoải mái.
Xe còn tích hợp những tính năng tiện lợi như gạt chân chống nghiêng tự động tắt máy, hệ thống đèn báo LED sáng đẹp, bền bỉ cùng ổ khóa đa năng, chỉ cần xoay chìa là mở được mọi thứ, hệ thống đèn vị trí LED ở đầu xe, phanh đùm tăng độ an toàn khi vận hành.
Bên cạnh Candy Hermosa 50cc, Kymco tiếp tục cải tiến dòng xe Like 50cc vốn được nhiều người dùng ưa chuộng. Phiên bản mới vẫn mang trên mình thiết kế thời trang, nhấn mạnh vào độ nhỏ gọn, các đường nét tinh tế và phù hợp cho cả nam và nữ.
Like 50cc vẫn giữ lại nhiều tính năng tiện ích để phù hợp với các bạn nữ sinh. Điển hình là chiều cao yên 76cm, độ dốc thấp để hai người ngồi thoải mái, gác chân sau tự mở bằng một nút bấm, cốp rộng rãi, bánh xe 12 inch với lốp không săm, hệ thống đèn báo đạt chuẩn và nắp bình xăng phía trước tiện lợi.
Phiên bản xe Like 50 của năm nay đã được nâng cấp nhiều tính năng như thiết kế vành trước, sau dáng thể thao, phanh đùm an toàn, gạt chân chống tự động tắt máy, xi nhan, đèn hậu và đèn vị trí sử dụng bóng LED và hệ thống điện DC đảm bảo ổn định về độ sáng khi sử dụng vào ban đêm.
Kymco là hãng xe máy Đài Loan (Trung Quốc), tách ra từ Honda Nhật Bản. Hãng đã có mặt tại hơn 100 quốc gia trên toàn thế giới, thuộc top 5 thương hiệu lớn tại châu Âu. Ra mắt thị trường Việt Nam từ năm 2004, đến nay Kymco có hơn 100 đại lý chính hãng và nhiều trạm bảo hành trên toàn quốc, thu hút người tiêu dùng nhờ những dòng xe 50cc mẫu mã đẹp, giá cả hợp lý, chế độ bảo hành rõ ràng.
Thông tin chi tiết liên hệ Công ty TNHH Kwang Yang Việt Nam:
- Địa chỉ: lô C2-2, C2-3 khu công nghiệp Đại Đăng, khu phố 3, phường Phú Tân, TP Thủ Dầu Một, tỉnh Bình Dương
- Hotline: 0274.3669899 - 18001548
- Fax: 0274.3669889
- Website: http://www.kymco.com.vn
Bảo An ",https://vnexpress.net/bo-doi-xe-may-kymco-50cc-cho-hoc-sinh-4142947.html
86,Sắc lệnh cấm ứng dụng đào hố ngăn cách công nghệ Mỹ - Trung,Sắc lệnh cấm giao dịch với ByteDance và Tencent của chính quyền Trump càng khiến sự chia rẽ giữa hai cường quốc Internet trở nên rộng hơn.,"Tổng thống Mỹ Donald Trump hôm 6/8 ký sắc lệnh cấm mọi cá nhân, tổ chức tại Mỹ giao dịch với ByteDance và Tencent, chủ sở hữu của TikTok và WeChat, sau 45 ngày nữa. Ông chủ Nhà Trắng tuyên bố các ứng dụng của Trung Quốc là mối đe dọa đối với ""an ninh quốc gia, chính sách đối ngoại và kinh tế"" của Mỹ, khẳng định nước này cần hành động quyết liệt để bảo vệ an ninh quốc gia.
Sắc lệnh có thể khiến các nền tảng này phải ngừng hoạt động tại Mỹ, cho thấy chính quyền Trump đang mở rộng đòn công kích tới những tập đoàn công nghệ hàng đầu Trung Quốc.
Các nhà phân tích cho rằng động thái nhằm vào WeChat của Mỹ có thể khiến Trung Quốc phản ứng mạnh, dù ứng dụng này có số lượng người dùng tại Mỹ thấp hơn nhiều so với TikTok. Phần lớn 1,2 tỷ người dùng WeChat đang sinh sống tại Trung Quốc, số còn lại dựa vào nó để liên lạc với người thân và bạn bè ở quê hương. Một cách tự nhiên, ứng dụng trở thành nền tảng truyền thông hiệu quả của chính quyền Trung Quốc.
Sắc lệnh của Tổng thống Trump sẽ có hiệu lực sau 45 ngày. Trong thời gian này, Bộ trưởng Tài chính Mỹ,Wilbur Ross, sẽ có nhiệm vụ định nghĩa những giao dịch bị cấm là gì, điều này có thể khiến người dùng và doanh nghiệp phải gấp rút đánh giá mức độ ảnh hưởng của sắc lệnh với họ.
Lệnh cấm được áp dụng rộng rãi và triệt để sẽ gây hại cho nhiều doanh nghiệp Mỹ tại Trung Quốc. Những thương hiệu như Starbucks và Walmart đều quảng cáo sản phẩm và nhận thanh toán trên WeChat.
""Nếu sắc lệnh cấm niêm yết và phân phối WeChat, TikTok cũng như chặn quảng cáo trên hai nền tảng này, chúng sẽ phải bị xóa khỏi hệ thống App Store và Google Play, cũng như không được phép quảng cáo những sản phẩm của Mỹ. Danh sách cấm càng dài, lệnh cấm càng gây nhiều tác hại"", Weiheng Chen, thành viên công ty luật Wilson Sonsini, nhận định.
Sắc lệnh nằm trong chiến dịch của chính quyền Trump nhằm cấm ""các ứng dụng Trung Quốc không đáng tin cậy"" trên cửa hàng ứng dụng của các nhà mạng và hãng sản xuất điện thoại di động tại nước này. Giới chức Mỹ thường xuyên bày tỏ quan ngại khả năng các ứng dụng mạng xã hội bị Trung Quốc tận dụng để thu thập dữ liệu người dùng và phục vụ mục đích bất chính.
""Đó là bước đi lớn hướng tới chia rẽ mạng Internet toàn cầu. Chúng ta đang chứng kiến một cuộc Chiến tranh Lạnh về công nghệ"", Ian Bremmer, Chủ tịch tập đoàn tư vấn chính trị Eurasia Group, nhận xét.
Bộ Ngoại giao Trung Quốc cáo buộc Mỹ ""thao túng và đàn áp chính trị"" sau khi Trump ký sắc lệnh. ""Mỹ thường xuyên lạm dụng quyền lực quốc gia và đàn áp một cách vô cớ các công ty không thuộc Mỹ"", phát ngôn viên Bộ Ngoại giao Trung Quốc, Uông Văn Bân, nói tại cuộc họp báo ở Bắc Kinh hôm 7/8.
TikTok khẳng định sắc lệnh được thông qua mà không tuân thủ quy định pháp luật. TikTok cho biết họ ""cảm thấy sốc"" và có thể ra tòa án Mỹ để đảm bảo được đối xử công bằng. Nhiều người dùng WeChat tại Trung Quốc và Mỹ đang thảo luận về những hệ lụy từ lệnh cấm và phương án thay thế ứng dụng này.
""Tôi và vợ đang rất lo lắng. Ban hành lệnh cấm nhằm vào một kênh liên lạc chủ chốt kết nối hai quốc gia là ý tưởng thảm họa. Nếu có bằng chứng cho thấy WeChat không tuân thủ luật pháp địa phương, hãy buộc họ sửa đổi và thực thi điều đó"", Greg Pilarowski, người sáng lập công ty luật Pillar Legal có trụ sở tại San Francisco, cho hay. Anh và vợ dùng WeChat hàng này để liên lạc với gia đình, bạn bè và khách hàng tại Trung Quốc.
Trường hợp xấu nhất với Tencent là các công ty Mỹ bị cấm cung cấp chip và thiết bị phần cứng cho máy chủ vận hành WeChat, cũng như ứng dụng Weixin và nhiều mảng kinh doanh khác. ""Tình thế khi đó sẽ giống Huawei hiện nay"", David Dai, nhà phân tích cấp cao tại công ty nghiên cứu Bernstein C. Sanford, nhận xét.
Tencent là một trong những người khổng lồ công nghệ Trung Quốc với giá trị khoảng 650 tỷ USD, đồng thời duy trì liên hệ thân cận với chính phủ. CEO Pony Ma từng là đại biểu quốc hội từ năm 2013 và từng tháp tùng Chủ tịch Trung Quốc Tập Cận Bình đến Mỹ cách đây 5 năm.
WeChat được Tencent phát hành năm 2011 với vai trò là ứng dụng nhắn tin, nhưng đã trở thành ""siêu ứng dụng"" cho phép người dùng gửi tin nhắn, hình ảnh và video, nhận tin tức và dữ liệu, mua vé tàu và máy bay, cũng như thanh toán trong nhiều cửa hàng. Tuy nhiên, nó cũng bị nhiều tổ chức nghiên cứu phương Tây cáo buộc là công cụ tuyên truyền của Trung Quốc và phải chịu sự giám sát, kiểm duyệt chặt chẽ về nội dung.
Dù vậy, nhiều chuyên gia vẫn cho rằng sắc lệnh của Trump là quá mức và có thể dẫn tới phản ứng đáp trả của Trung Quốc. ""Có mối đe dọa thật sự về an ninh và quyền riêng tư với người dùng WeChat, nhưng lệnh cấm triệt để là quá cực đoan, mang tầm nhìn ngắn hạn và dễ phản tác dụng"", Giám đốc phòng nghiên cứu Citizen Lab, Ronald Deibert, nêu quan điểm.
Điệp Anh (theo Wall Street Journal)",https://vnexpress.net/sac-lenh-cam-ung-dung-dao-ho-ngan-cach-cong-nghe-my-trung-4143561.html
87,iPhone 12 gặp lỗi khi thử nghiệm,"Lớp phủ ống kính camera cho iPhone 12 bị nứt trong quá trình thử nghiệm, khiến Apple phải làm việc lại với nhà cung ứng.","Theo nhà phân tích Ming-Chi Kuo, sự cố này xảy ra với nhà cung ứng ống kính camera điện thoại tên Yujingguang. Ống kính do đơn vị này cung cấp gặp hiện tượng nứt vỡ lớp phủ bên ngoài, khi thử nghiệm ở điều kiện nhiệt độ và độ ẩm cao. Đây là bài thử nghiệm dành cho iPhone, để có thể đáp ứng được điều kiện khí hậu vùng nhiệt đới.
Yujingguang là đơn vị cung ứng linh kiện cho hai phiên bản iPhone 12 và iPhone 12 Max, nên sự cố này không ảnh hưởng đến quá trình sản xuất của bản Pro. Ngoài ra, Apple còn có một nhà cung ứng ống kính khác là Largan, có thể bù đắp được sự chậm trễ do Yujingguang gây ra.
Theo Ming-Chi Kuo, Apple thậm chí có thể biến sự cố này thành lợi thế cho mình. Đơn hàng của Apple có giá trị khoảng 2 - 2,2 USD cho mỗi ống kính, nhưng Yujingguang có thể ""bị ép"" phải cung cấp chúng với giá 1,5 USD nếu họ muốn tiếp tục ""làm ăn"" với Apple khi sự cố được khắc phục.
Việc gặp lỗi trong quá trình thử nghiệm có thể xảy ra với bất kỳ sản phẩm và nhà cung ứng nào. Tuy nhiên, sự cố xảy ra gần ngày ra mắt sản phẩm khiến nhiều người lo lắng về tiến độ của iPhone 12.
Apple đã thừa nhận năm nay sẽ giới thiệu iPhone 12 chậm hơn mọi năm. Vì vậy, hãng hoàn toàn có thể kiểm soát được sự cố với các nhà cung ứng. Tuy nhiên, nguồn tin từ DigiTimes cho biết, Apple có thể phải chia việc ra mắt bộ bốn iPhone 12 thành hai đợt, do bo mạch cho iPhone 12 và iPhone 12 Max Pro vẫn chưa sẵn sàng.
Theo các thông tin rò rỉ, sẽ có ít nhất bốn phiên bản iPhone 12, gồm iPhone 12, 12 Max, 12 Pro và 12 Pro Max, với kích thước màn hình từ 5,4 đến 6,7 inch. Sản phẩm mới sử dụng màn hình OLED, chip Apple A14 Bionic, có kết nối 5G hỗ trợ cả băng tần sub-6 và mmWave.
Quý Văn",https://vnexpress.net/iphone-12-gap-loi-khi-thu-nghiem-4143577.html
88,Người Trung Quốc tìm ứng dụng thay WeChat,Nhiều người Trung Quốc tìm đến ứng dụng nhắn tin mã hoá Signal để liên lạc với người thân tại Mỹ khi WeChat rơi vào tầm ngắm của Trump.,"Số lượt tải về ứng dụng Signal tại Trung Quốc tăng vọt những ngày gần đây, người đại diện Signal chia sẻ với CNBC. Mặc dù không tiết lộ lượt tải chính xác, người này cho biết các chỉ số bắt đầu tăng vọt ít giờ trước khi Trump ban hành sắc lệnh liên quan đến ứng dụng WeChat.
Cụ thể, sắc lệnh này cấm mọi cá nhân, tổ chức tại Mỹ giao dịch với ByteDance và Tencent, chủ sở hữu của TikTok và WeChat, sau 45 ngày kể từ 6/8. Mặc dù không nhắc đến việc cấm sử dụng WeChat tại Mỹ, nhiều người lo ngại điều này có thể trở thành sự thực.
Tại Mỹ, WeChat được sử dụng không nhiều nhưng đây lại là công cụ thiết yếu trong việc trao đổi thông tin của những người đang sống ở đây với bạn bè, gia đình và đối tác tại Trung Quốc. Trong khi đó, Signal là ứng dụng có nguồn gốc của Mỹ. Nhưng khác với Facebook Messenger hay WhatsApp, Signal không bị chặn tại Trung Quốc. Người dùng smartphone tại Trung Quốc có thể tải Signal qua App Store hoặc website của hãng.
Để chuẩn bị cho tương lai WeChat có thể bị cấm tại Mỹ, hoặc Signal có thể bị cấm tại Trung Quốc, nhiều người Trung Quốc đã bắt đầu tải Signal.
Theo Jun Harada - người phát ngôn của Signal, số lượt tải ứng dụng này tại Trung Quốc ""có vẻ ngang bằng, nếu không muốn nói là lớn hơn so với thời điểm chúng tôi ở vị trí số 1 trên App Store ở Hong Kong"". Jun Harada nhắc lại thời điểm một tháng trước, khi luật an ninh Hong Kong có hiệu lực, người dân tại đây cũng đổ xô tải Signal.
Signal là ứng dụng nhắn tin mã hoá đầu cuối, không lưu trữ thông tin người dùng và được đánh giá cao bởi những người ủng hộ quyền riêng tư. Khả năng mã hoá của Signal được đánh giá cao hơn Telegram. Tuy nhiên, theo nhiều chuyên gia, việc được tải nhiều thời gian gần đây có thể khiến Signal ""rơi vào tầm ngắm"" và nhiều khả năng có thể bị chặn giống WhatsApp hoặc Telegram trước đây tại Trung Quốc.
WeChat được coi là một ""siêu ứng dụng"" tại Trung Quốc. Người dân nước này sử dụng WeChat trong cuộc sống hàng ngày, từ gọi taxi, đặt đồ ăn, đọc tin tức và cả việc xem các ca mắc Covid-19 có ở gần mình hay không. Ứng dụng này đã thay thế phần lớn các cuộc gọi điện thoại và email, tin nhắn văn bản, thậm chí thanh toán và trở thành một phần không thể thiếu của người dân Trung Quốc. Tuy nhiên, WeChat bị đánh giá là thu thập một lượng lớn dữ liệu của người dùng và là công cụ để chính phủ Trung Quốc theo dõi người dân.
Quý Văn",https://vnexpress.net/nguoi-trung-quoc-tim-ung-dung-thay-wechat-4143575.html
89,Trắc nghiệm: Bạn hiểu gì về Bluezone?,Bluezone là ứng dụng truy vết Covid-19 do Việt Nam phát triển. Hãy trả lời các câu hỏi sau để xem bạn hiểu gì về ứng dụng này.,,https://vnexpress.net/trac-nghiem-ban-hieu-gi-ve-bluezone-4143339.html
90,Huawei ‘khai tử' mảng chip di động,Huawei sẽ ngừng làm chip Kirin từ tháng 9 tới do nguồn cung ứng gặp khó khăn vì áp lực từ Mỹ.,"Áp lực của Mỹ tới các nhà cung ứng linh kiện khiến HiSilicon - một công ty con của Huawei - không thể tiếp tục sản xuất chip di động, Richard Yu - Giám đốc mảng Kinh doanh Tiêu dùng của Huawei - chia sẻ trong một hội nghị công nghệ tại Trung Quốc.
Theo ông Yu, công ty vẫn sẽ ra mắt Mate 40 vào tháng 9 tới, sử dụng chip Kirin 1020 mạnh nhất của hãng. Tuy nhiên, đây cũng là mẫu máy cuối cùng của Huawei sử dụng chip này. ""Từ ngày 15/9 trở đi, vi xử lý Kirin hàng đầu của chúng tôi sẽ còn ra mắt nữa. Chip hỗ trợ AI cũng không thể tiếp tục tiến hành. Đây là một mất mát lớn với chúng tôi"", trang Caixin của Trung Quốc dẫn lời Richard Yu.
Hồi tháng 5, Bộ Thương mại Mỹ đã ban hành lệnh cấm các nhà cung cấp phần mềm và thiết bị kinh doanh với Huawei nếu không xin phép. Bộ phận chip của Huawei vốn phụ thuộc vào phần mềm thiết kế chip từ các công ty của Mỹ, như Cadence Design Systems hoặc Synopsys, còn việc sản xuất mới được giao cho TSMC - một công ty chuyên gia công chip vốn cũng sử dụng nhiều thiết bị và công nghệ của Mỹ.
TSMC sẽ giao toàn bộ đơn hàng Kirin 1020 trước ngày 14/9. Vi xử lý này được cho là sản xuất trên quy trình 5nm, tương tự Qualcomm Snapdragon 875G.
Hiện các đơn vị liên quan đều chưa bình luận gì về việc này
Theo Reuters, HiSilicon là công ty sản xuất chip duy nhất tại Trung Quốc có thể sánh ngang với Qualcomm. Đơn vị này đã đầu tư những nguồn lực khổng lồ để có được ngày hôm nay. ""Huawei bắt đầu khám phá lĩnh vực chip từ hơn 10 năm trước. Chúng tôi đi từ mức tụt hậu lớn, đến tụt hậu một chút, để rồi bắt kịp và sau đó dẫn đầu"", Yu nói, đồng thời cho biết công ty đã phải trải qua những giai đoạn vô cùng khó khăn.
Theo PhoneArena, HiSilicon từng lọt top 10 nhà sản xuất chip hàng đầu thế giới năm nay, nhưng có thể sẽ phải đóng cửa thời gian tới. Các công ty còn lại trong lĩnh vực chip, như Qualcomm và MediaTek, được cho là đang cạnh tranh để trở thành nhà cung cấp chip di động cho Huawei trong các smartphone sắp tới.
Lưu Quý",https://vnexpress.net/huawei-khai-tu-mang-chip-di-dong-4143555.html
91,VinSmart bán 500 TV trong ba ngày,50KD6800 - TV 50 inch giá dưới 10 triệu đồng của VinSmart - nhận được 500 lượt đặt hàng sau ba ngày mở bán.,"Các mẫu TV của VinSmart ra mắt từ cuối năm 2019 nhưng đến nay mới được mở bán rộng rãi ở các đại lý và nhà bán lẻ. Một số mẫu TV của hãng công nghệ Việt giảm giá mạnh, như 50KD6800 giảm 1,2 triệu đồng, từ mức 10,7 triệu xuống 9,5 triệu đồng, tặng kèm điện thoại Vsmart Joy 3, nên được nhiều người chú ý.
So với các sản phẩm cùng độ phân giải 4K, kích thước 49 - 50 inch khác, như Samsung UA50TU7000, LG 49UM7400PTA, Sony KD-49X8000G, TV Vsmart 50KD6800 rẻ hơn từ 1 đến 2 triệu đồng, đồng thời sử dụng hệ điều hành Android TV.
Ngoài 50KD 6800, Vsmart còn 4 mẫu TV khác là 43KD6600 (7,49 triệu đồng), 55KD6800 (10,99 triệu đồng), 49KE8100 (12,99 triệu đồng) và 55KE8500 (15,49 triệu đồng). Kích thước màn hình là hai chữ số đầu tiên trong tên của TV, còn KD, KE là ký hiệu dòng sản phẩm. Trong đó, KE là dòng cao cấp, màn hình mỏng.
Các TV này đều có độ phân giải 4K, chạy Android TV, âm thanh Dolby Digital Plus, trợ lý ảo Google Assistant và được sản xuất ở nhà máy TV của VinSmart tại Hoà Lạc (Hà Nội).
Lưu Quý",https://vnexpress.net/vinsmart-ban-500-tv-trong-ba-ngay-4143429.html
92,Người Trung Quốc bất ngờ vì Việt Nam sản xuất Galaxy Note20,Thông tin dòng điện thoại Galaxy Note20 của Samsung được sản xuất tại Việt Nam khiến người dùng tại Trung Quốc ngạc nhiên xen lẫn hoài nghi về chất lượng sản phẩm.,"Vài ngày trước sự kiện Unpacked 2020, mục công nghệ trên Weibo, mạng xã hội lớn nhất Trung Quốc, đăng nhiều thông tin rò rỉ về bộ đôi Samsung Galaxy Note20 và Note20 Ultra. Trong đó, chi tiết ""smartphone đầu bảng của Samsung được sản xuất ở Việt Nam"" thành tâm điểm bàn tán của các thành viên mạng xã hội này.
""Samsung không còn sản xuất điện thoại ở Trung Quốc. Chúng ta phải chấp nhận thôi. Ngay cả nhà máy sản xuất máy tính xách tay cuối cùng cũng đã dời đi rồi"", tài khoản Quiying bình luận. Nhiều người tỏ ra tiếc nuối. Tài khoản Wuer viết: ""Tại sao không phải ở Trung Quốc? Thật đáng tiếc, nếu sản xuất ở Trung Quốc tôi sẽ ủng hộ ngay. Điện thoại trông rất đẹp, cấu hình cũng tất tốt, nhưng vì sản xuất ở Việt Nam nên tôi sẽ cân nhắc"".
Trang công nghệ Lin Jiayu với hơn 2,3 triệu lượt theo dõi đưa ra câu hỏi: ""Samsung Galaxy Note20 Ultra sản xuất tại Việt Nam. Bạn sẽ mua chứ?"". Bài viết thu hút hàng trăm lượt thảo luận chỉ trong hai ngày.
Một số người hoài nghi, họ không tin Việt Nam có thể sản xuất được smartphone cao cấp. Tài khoản Hexinjie viết: ""Lần đầu tiên tôi thấy một smartphone đầu bảng sản xuất ở Việt Nam. Khó mà tin được họ có thể lắp ráp được một thiết bị đắt tiền. Tôi nghi ngờ về chất lượng sản phẩm"". Đáp lại, tài khoản Jing Zhuangya nói: ""Chẳng có gì lạ cả. Nếu đọc báo nước ngoài bạn sẽ biết Samsung có nhiều nhà máy lắp ráp lớn ở Việt Nam. Họ đã sản xuất điện thoại ở đây cả chục năm rồi"".
Một số khác cho rằng sản xuất ở Việt Nam, Ấn Độ hay Trung Quốc đều không có gì khác biệt vì công nhân đều được đào tạo theo quy chuẩn và máy móc sẽ hỗ trợ những khâu quan trọng nhất. Tuy nhiên, nhóm bảo thủ vẫn cho rằng các quốc gia nhỏ khó có thể sản xuất được những sản phẩm tinh vi.
Những người đứng giữa cuộc tranh cãi nêu ý kiến cần phải trải nghiệm thực tế mới đánh giá được. ""Đó là một món hàng đắt tiền, đừng tranh cãi mà chưa tận tay trải nghiệm. Nếu thiết bị tốt thì nên mua, dù nó được sản xuất ở đâu chăng nữa"", tài khoản Zimo Yuge bình luận. Người dùng có biệt danh Dachuan viết: ""Chỉ những người ấu trĩ mới nói rằng 'nếu không sản xuất ở Trung Quốc thì đừng bán sang Trung Quốc'. Nếu ai cũng nghĩ vậy thì các thương hiệu Trung Quốc làm sao bán được khắp thế giới"".
Người dùng Zhang Xiaodian đã dẫn lại bài viết của trang công nghệ Sina về mẫu smartphone 5G đầu tiên do Việt Nam sản xuất và bình luận: ""Việt Nam đang phát triển rất nhanh, nhiều nhà máy của các tập đoàn lớn đã rời về đây. Công ty nội địa của Việt Nam đã sản xuất được smartphone 5G. Họ đang bắt kịp thế giới rồi"". Bình luận của Zhang sau đó nhận được nhiều lượt thích. Một người khác trích lời Reuters vào bình luận: ""Phân nửa smartphone Samsung bán trên thế giới được sản xuất tại Việt Nam"".
Sau sự kiện ra mắt bộ ba Note20 mới, đại diện Samsung Việt Nam cũng xác nhận một phần sản lượng Galaxy Note20, Note20 Ultra bán trên toàn cầu được sản xuất tại Việt Nam. Ngoài ra, nhà máy Samsung tại Việt Nam còn sản xuất nhiều thiết bị chủ lực khác, như đồng hồ Galaxy Watch, máy tính bảng Galaxy Tab và tai nghe Galaxy Buds. Hiện tại, công ty có hai nhà máy đặt ở Bắc Ninh, Thái Nguyên, một tại Khu Công nghệ cao TP HCM.
Ngoài những tranh cãi về xuất xứ sản phẩm, người dùng Trung Quốc cũng có những quan điểm trái chiều về 3 model Note mới. Phần lớn ý kiến cho rằng Galaxy Note20 và Note20 Ultra xứng đáng là smartphone Android cao cấp nhất. Một số tỏ ra thích thú với màu vàng đồng mới, số khác nói họ ấn tượng với tai nghe Galaxy Buds. Tuy nhiên, cũng có những người cho rằng ngoại hình của bộ đôi Note20 không có nhiều khác biệt. Thiết bị trông nam tính và giá quá cao so với smartphone cao cấp của Trung Quốc.
Kim Cương",https://vnexpress.net/nguoi-trung-quoc-bat-ngo-vi-viet-nam-san-xuat-galaxy-note20-4143178.html
